Brand,Product_Name,Price,MRP,Rating,Reviews,Category,URL
Royal Export,Floral Embroidered Straight Thread Work Kurta With Trousers & Dupatta,1117,5999,4.3,24,Women Clothing,https://www.myntra.com/kurta-sets/royal+export/royal-export-floral-embroidered-straight-thread-work-kurta-with-trousers--dupatta/35887931/buy
Indo Era,Floral Yoke Design Thread Work A-Line Kurta With Trousers & Dupatta,1999,6999,4,1,Women Clothing,https://www.myntra.com/kurta-sets/indo+era/indo-era-floral-yoke-design-thread-work-a-line-kurta-with-trousers--dupatta/24838918/buy
Indo Era,Women Ethnic Motifs Printed Straight Kurta,799,2499,4.2,38,Women Clothing,https://www.myntra.com/kurtas/indo+era/indo-era-women-ethnic-motifs-printed-straight-kurta/34123782/buy
Khushal K,Floral Printed V-Neck A-Line Pure Cotton Kurta with Palazzos & With Dupatta,1597,3399,3.9,75,Women Clothing,https://www.myntra.com/kurta-sets/khushal+k/khushal-k-floral-printed-v-neck-a-line-pure-cotton-kurta-with-palazzos--with-dupatta/32770998/buy
SINGNI,Floral Printed Mirror Work A-Line Kurta With Trousers & Dupatta,1169,6499,4,3,Women Clothing,https://www.myntra.com/kurta-sets/singni/singni-floral-printed-mirror-work-a-line-kurta-with-trousers--dupatta/24146476/buy
Anouk,Yellow Floral Embroidered A-Line Kurta,836,2699,3.8,184,Women Clothing,https://www.myntra.com/kurtas/anouk/anouk-yellow-floral-embroidered-a-line-kurta/30867190/buy
KALINI,Women Regular Kurta with Trousers & With Dupatta,999,4345,3.1,372,Women Clothing,https://www.myntra.com/kurta-sets/kalini/kalini-women-regular-kurta-with-trousers--with-dupatta/31672123/buy
Sangria,Floral Embroidered Mandarin Collar Cotton A-Line Kurta With Trouser & Dupatta,1583,4799,4.4,104,Women Clothing,https://www.myntra.com/kurta-sets/sangria/sangria-floral-embroidered-mandarin-collar-cotton-a-line-kurta-with-trouser--dupatta/32770645/buy
GoSriKi,Women Printed Regular Thread Work Kurta with Palazzos & With Dupatta,1098,4345,3,106,Women Clothing,https://www.myntra.com/kurta-sets/gosriki/gosriki-women-printed-regular-thread-work-kurta-with-palazzos--with-dupatta/33989298/buy
Libas,Women Floral Printed Sequins Straight Kurta,699,2449,4.2,175,Women Clothing,https://www.myntra.com/kurtas/libas/libas-women-floral-printed-sequins-straight-kurta/33460553/buy
KALINI,Floral Printed Mandarin Collar Pure Cotton Straight Kurta With Trousers & Dupatta,999,5999,4.1,352,Women Clothing,https://www.myntra.com/kurta-sets/kalini/kalini-floral-printed-mandarin-collar-pure-cotton-straight-kurta-with-trousers--dupatta/30718431/buy
Libas,Floral Printed Notch Neck Straight Kurta With Trousers And Dupatta,1599,4699,4.7,7,Women Clothing,https://www.myntra.com/kurta-sets/libas/libas-floral-printed-notch-neck-straight-kurta-with-trousers-and-dupatta/34139604/buy
Sangria,Blue Printed Gotta Patti Pure Cotton Empire A-Line Kurta with Trousers & Dupatta,1376,8099,4.1,4,Women Clothing,https://www.myntra.com/kurta-sets/sangria/sangria-blue-printed-gotta-patti-pure-cotton-empire-a-line-kurta-with-trousers--dupatta/23281956/buy
Stylum,Striped Woven Design V-Neck Beads and Stones Straight Kurta With Trousers & Dupatta,779,2999,4.2,391,Women Clothing,https://www.myntra.com/kurta-sets/stylum/stylum-striped-woven-design-v-neck-beads-and-stones-straight-kurta-with-trousers--dupatta/28411160/buy
TWINS LADY,Women Ethnic Embroidered Regular Kurta with Trousers & With Dupatta,1299,4499,4.1,26,Women Clothing,https://www.myntra.com/kurta-sets/twins+lady/twins-lady-women-ethnic-embroidered-regular-kurta-with-trousers--with-dupatta/34815745/buy
MOKOSH,Floral Yoke Design Notch Neck Sequinned A-Line Kurta With Trousers & Dupatta,1567,4899,4.4,421,Women Clothing,https://www.myntra.com/kurta-sets/mokosh/mokosh-floral-yoke-design-notch-neck-sequinned-a-line-kurta-with-trousers--dupatta/32737401/buy
Sangria,Geometric Sequinned V-Neck Georgette Empire A-Line Kurta With Trouser & Dupatta,1994,6649,4,43,Women Clothing,https://www.myntra.com/kurta-sets/sangria/sangria-geometric-sequinned-v-neck-georgette-empire-a-line-kurta-with-trouser--dupatta-/32760712/buy
KALINI,Abstract Printed Round Neck Kurta with Harem Pants,749,2499,4.1,35,Women Clothing,https://www.myntra.com/kurta-sets/kalini/kalini-abstract-printed-round-neck-kurta-with-harem-pants/32718290/buy
Anouk,Navy Blue Ethnic Motifs Printed Shoulder Straps Anarkali Kurta with Churidar&Dupatta,1439,4799,4.2,256,Women Clothing,https://www.myntra.com/kurta-sets/anouk/anouk-navy-blue-ethnic-motifs-printed-shoulder-straps-anarkali-kurta-with-churidardupatta/30478916/buy
Sangria,Women Yellow Bandhani Embroidered Thread Work Kurta,799,3999,4.3,725,Women Clothing,https://www.myntra.com/kurtas/sangria/sangria-women-yellow-bandhani-embroidered-thread-work-kurta/20838310/buy
PARTHVI,Floral Printed Regular Pure Cotton Anarkali Kurta With Trouser With Dupatta,999,6666,4.1,182,Women Clothing,https://www.myntra.com/kurta-sets/parthvi/parthvi-floral-printed-regular-pure-cotton-anarkali-kurta-with-trouser-with-dupatta/31593506/buy
Indo Era,Ethnic Motifs Yoke Design Thread Work Kurta With Trousers & Dupatta,1299,6599,4.1,658,Women Clothing,https://www.myntra.com/kurta-sets/indo+era/indo-era-ethnic-motifs-yoke-design-thread-work-kurta-with-trousers--dupatta/29482042/buy
Anouk Rustic,Floral Printed V-Neck Pure Cotton Straight Kurta With Palazzos,999,3399,4,101,Women Clothing,https://www.myntra.com/kurta-sets/anouk+rustic/anouk-rustic-floral-printed-v-neck--pure-cotton-straight-kurta-with-palazzos/34657378/buy
Sangria,Women Ethnic Motifs Embroidered A-Line Kurta Sets With Dupatta,1694,5649,3.3,16,Women Clothing,https://www.myntra.com/kurta-sets/sangria/sangria-women-ethnic-motifs-embroidered-a-line-kurta-sets-with-dupatta/33801173/buy
KALINI,Striped Regular Thread Work Kurta with Palazzos,911,2463,4,64,Women Clothing,https://www.myntra.com/kurta-sets/kalini/kalini-striped-regular-thread-work-kurta-with-palazzos/27874036/buy
Pristyle,Floral Printed Pleated Round Neck Maternity Anarkali Kurta,480,2999,3.7,67,Women Clothing,https://www.myntra.com/kurtas/pristyle/pristyle-floral-printed-pleated-round-neck-maternity-anarkali-kurta/32115533/buy
Libas,Women Teal Blue & Gold Ethnic Motifs Zari Straight Kurta with Trousers Dupatta,1599,3999,4.5,5,Women Clothing,https://www.myntra.com/kurta-sets/libas/libas-women-teal-blue--gold-ethnic-motifs-zari-straight-kurta-with-trousers-dupatta/17487014/buy
Anouk,Geometric Printed Kurta,539,1799,4.2,1,Women Clothing,https://www.myntra.com/kurtas/anouk/anouk-geometric-printed-kurta/27224306/buy
FoxDX,Women Woven Design Yoke Design Silk Kurta with Trousers & Dupatta,999,4999,3.1,121,Women Clothing,https://www.myntra.com/kurta-sets/foxdx/foxdx-women-woven-design-yoke-design-silk-kurta-with-trousers--dupatta/34338177/buy
Ginni Arora Label,Floral Printed V-Neck Pure Cotton Kurta with Trousers & Dupatta,1448,3599,4.3,359,Women Clothing,https://www.myntra.com/kurta-sets/ginni+arora+label/ginni-arora-label-floral-printed-v-neck-pure-cotton-kurta-with-trousers--dupatta/28040296/buy
JAINICA,Women Floral Embroidered Kurta with Trousers & Dupatta,899,3499,3.4,7,Women Clothing,https://www.myntra.com/kurta-sets/jainica/jainica-women-floral-embroidered-kurta-with-trousers--dupatta/35060661/buy
Pristyle,Ethnic Motifs Gotta Patti Maternity Anarkali Kurta,480,2999,4,108,Women Clothing,https://www.myntra.com/kurtas/pristyle/pristyle-ethnic-motifs-gotta-patti-maternity-anarkali-kurta/32080320/buy
Libas,Women Ethnic Motifs Printed Kurta with Palazzo & Dupatta,1199,4549,4.1,17,Women Clothing,https://www.myntra.com/kurta-sets/libas/libas-women-ethnic-motifs-printed-kurta-with-palazzo--dupatta/35166435/buy
GoSriKi,Floral Printed Straight Kurta With Trouser,703,3197,3.2,1,Women Clothing,https://www.myntra.com/kurta-sets/gosriki/gosriki-floral-printed-straight-kurta-with-trouser/32400173/buy
Vbuyz,Floral Printed Shoulder Straps Boat Neck Cotton Straight Kurta,449,2999,4.2,344,Women Clothing,https://www.myntra.com/kurtas/vbuyz/vbuyz-floral-printed-shoulder-straps-boat-neck-cotton-straight-kurta/32415409/buy
Janasya,Floral Embroidered V-Neck Georgette A-Line Kurta with Palazzo & Dupatta,1899,4998,4.2,116,Women Clothing,https://www.myntra.com/kurta-sets/janasya/janasya-floral-embroidered-v-neck-georgette-a-line-kurta-with-palazzo--dupatta/30537512/buy
Anouk,Ethnic Motifs Printed Regular Mirror Work Straight Kurta with Palazzos & Dupatta,1967,8199,3.4,136,Women Clothing,https://www.myntra.com/kurta-sets/anouk/anouk-ethnic-motifs-printed-regular-mirror-work-straight-kurta-with-palazzos--dupatta/30812018/buy
Royal Export,Women Ethnic Motifs Printed Regular Kurta with Trousers & With Dupatta,582,2999,4.2,146,Women Clothing,https://www.myntra.com/kurta-sets/royal+export/royal-export-women-ethnic-motifs-printed-regular-kurta-with-trousers--with-dupatta/30236075/buy
Janasya,Women's Lavender Silk Blend Embellished Kurta with Pant and Dupatta,1399,4239,4,1,Women Clothing,https://www.myntra.com/kurta-sets/janasya/janasya-womens-lavender-silk-blend-embellished-kurta-with-pant-and-dupatta/30251611/buy
Nayo,Women Maroon & Cream-Coloured Printed Kurta with Palazzos & Dupatta,1469,3499,4.1,4,Women Clothing,https://www.myntra.com/kurta-sets/nayo/nayo-women-maroon--cream-coloured-printed-kurta-with-palazzos--dupatta/14170548/buy
Aaghnya,Women Solid Kurta with Palazzo & Dupatta,869,4345,3.7,121,Women Clothing,https://www.myntra.com/kurta-sets/aaghnya/aaghnya-women-solid-kurta-with-palazzo--dupatta/34480073/buy
Vishudh,Floral Woven Design Zari Jacquard Weave Straight Kurta with Trousers & Dupatta,1127,4699,4.6,22,Women Clothing,https://www.myntra.com/kurta-sets/vishudh/vishudh-floral-woven-design-zari-jacquard-weave-straight-kurta-with-trousers--dupatta/31863528/buy
Anouk,Printed Pure Cotton Kurta With Palazzo,998,3699,4.4,450,Women Clothing,https://www.myntra.com/kurta-sets/anouk/anouk-printed-pure-cotton-kurta-with-palazzo/30775333/buy
GoSriKi,Bandhani Printed Thread Work Puffed Sleeves A-Line Kurta With Trousers,899,3197,3.9,2,Women Clothing,https://www.myntra.com/kurta-sets/gosriki/gosriki-bandhani-printed-thread-work-puffed-sleeves-a-line-kurta-with-trousers/30880224/buy
SKYLEE,Women Floral Embroidered Kurta with Trousers & Dupatta,989,2198,4.3,8,Women Clothing,https://www.myntra.com/kurta-sets/skylee/skylee-women-floral-embroidered-kurta-with-trousers--dupatta/34644420/buy
max,Floral Mandarin Collar Three-Quarter Sleeves Thread Work Cotton Kurta,549,699,4.2,565,Women Clothing,https://www.myntra.com/kurtas/max/max-floral-mandarin-collar-three-quarter-sleeves-thread-work-cotton-kurta/29426572/buy
Rimeline,Floral Printed V-Neck Pure Cotton Straight Kurtas,619,1999,4.5,315,Women Clothing,https://www.myntra.com/kurtas/rimeline/rimeline-floral-printed-v-neck-pure-cotton-straight-kurtas/32398896/buy
Vishudh,Women Printed Regular Kurta with Trousers & With Dupatta,2293,6949,,,Women Clothing,https://www.myntra.com/kurta-sets/vishudh/vishudh-women-printed-regular-kurta-with-trousers--with-dupatta/33549463/buy
GoSriKi,Floral Printed V-Neck Straight Kurta With Palazzos And Dupatta,999,4345,3.7,663,Women Clothing,https://www.myntra.com/kurta-sets/gosriki/gosriki-floral-printed-v-neck-straight-kurta-with-palazzos-and-dupatta/32223636/buy
KALINI,Ethnic Motifs Foil Printed Regular Kurta With Trousers & Dupatta,1368,6520,3.8,1,Women Clothing,https://www.myntra.com/kurta-sets/kalini/kalini-ethnic-motifs-foil-printed-regular-kurta-with-trousers--dupatta/27393194/buy
Vishudh,Women Embroidered Regular Sequinned Kurta with Trousers & With Dupatta,899,3749,3.6,17,Women Clothing,https://www.myntra.com/kurta-sets/vishudh/vishudh-women-embroidered-regular-sequinned-kurta-with-trousers--with-dupatta/31783694/buy
Anouk Rustic,Women Ethnic Motifs Printed Regular Pure Cotton Kurta with Trousers,825,2500,3.9,14,Women Clothing,https://www.myntra.com/kurta-sets/anouk+rustic/anouk-rustic-women-ethnic-motifs-printed-regular-pure-cotton-kurta-with-trousers/35349153/buy
Vishudh,Women Floral Embroidered Regular Thread Work Kurta with Trousers & With Dupatta,2379,6999,,,Women Clothing,https://www.myntra.com/kurta-sets/vishudh/vishudh-women-floral-embroidered-regular-thread-work-kurta-with-trousers--with-dupatta/32977385/buy
KALINI,Ethnic Motifs Printed V-Neck Anarkali Kurta With Trousers And Dupatta,949,4999,4,919,Women Clothing,https://www.myntra.com/kurta-sets/kalini/kalini-ethnic-motifs-printed-v-neck-anarkali-kurta-with-trousers-and-dupatta/32565306/buy
Sangria,White Ethnic Motifs Embroidered Thread Work Straight Kurta & Trouser With Dupatta,1673,5399,4.2,1,Women Clothing,https://www.myntra.com/kurta-sets/sangria/sangria-white-ethnic-motifs-embroidered-thread-work-straight-kurta--trouser-with-dupatta/25006240/buy
Vishudh,Women Yellow Ethnic Motifs Printed Kurti with Palazzos & With Dupatta,1399,3499,4.3,1,Women Clothing,https://www.myntra.com/kurta-sets/vishudh/vishudh-women-yellow-ethnic-motifs-printed-kurti-with-palazzos--with-dupatta/17445614/buy
SZN,Women Floral Print Kurta Sets,961,2599,3.9,299,Women Clothing,https://www.myntra.com/kurta-sets/szn/szn-women-floral-print-kurta-sets/34717045/buy
Sangria,Floral Printed Mandarin Collar Pure Cotton A-Line Kurta,735,2299,3.9,7,Women Clothing,https://www.myntra.com/kurtas/sangria/sangria-floral-printed-mandarin-collar-pure-cotton-a-line-kurta/33126473/buy
Vishudh,Women Floral Printed Regular Kurta with Trousers,1231,4399,4.4,34,Women Clothing,https://www.myntra.com/kurta-sets/vishudh/vishudh-women-floral-printed-regular-kurta-with-trousers/31783692/buy
KALINI,Striped Round Neck Three-Quarter Sleeves Thread Work Kurta with Trousers,640,2463,4.2,1,Women Clothing,https://www.myntra.com/kurta-sets/kalini/kalini-striped-round-neck-three-quarter-sleeves-thread-work-kurta-with-trousers/27751618/buy
Indo Era,Mirror Work Embroidered Pleated Work Kurta with Trousers,1367,3599,4.2,269,Women Clothing,https://www.myntra.com/kurta-sets/indo+era/indo-era-mirror-work-embroidered-pleated-work-kurta-with-trousers/30864359/buy
Vishudh,Turquoise Blue & White Floral Printed Kurta With Trousers & Dupatta,755,3149,4.1,91,Women Clothing,https://www.myntra.com/kurta-sets/vishudh/vishudh-turquoise-blue--white-floral-printed-kurta-with-trousers--dupatta/22830786/buy
Sangria,Animal Printed Mandarin Collar Pure Cotton Straight Kurta With Trouser,1121,3299,3.2,249,Women Clothing,https://www.myntra.com/kurta-sets/sangria/sangria-animal-printed-mandarin-collar-pure-cotton-straight-kurta-with-trouser/33387214/buy
Libas,Womens Mauve Printed Cotton Anarkali Kurta With Churidar & Dupatta,1799,6399,4.7,18,Women Clothing,https://www.myntra.com/kurta-sets/libas/libas-womens-mauve-printed-cotton-anarkali-kurta-with-churidar--dupatta/34138356/buy
Vishudh,Women Straight Jacquard Kurta With Bottom & Dupatta,1930,4949,,,Women Clothing,https://www.myntra.com/kurta-sets/vishudh/vishudh-women-straight-jacquard-kurta-with-bottom--dupatta/32741280/buy
Inddus,Floral Printed V-Neck A-Line Kurta With Trousers,1971,6799,4.3,7,Women Clothing,https://www.myntra.com/kurta-sets/inddus/inddus-floral-printed-v-neck-a-line-kurta-with-trousers/33390884/buy
Varanga,Women Mustard Yoke Embroidered Pure Cotton Kurta with Trouser & Printed Dupatta,1199,4999,4.1,8,Women Clothing,https://www.myntra.com/kurta-sets/varanga/varanga-women-mustard-yoke-embroidered-pure-cotton-kurta-with-trouser--printed-dupatta/17251490/buy
Vishudh,Women Ethnic Motifs Printed Empire Kurta with Trousers & Jacket,1325,3899,4.4,696,Women Clothing,https://www.myntra.com/kurta-sets/vishudh/vishudh-women-ethnic-motifs-printed-empire-kurta-with-trousers--jacket/20120452/buy
Libas,Women Ethnic Motifs Regular Thread Work Kurta with Trousers & With Dupatta,999,3999,4.2,29,Women Clothing,https://www.myntra.com/kurta-sets/libas/libas-women-ethnic-motifs-regular-thread-work-kurta-with-trousers--with-dupatta/33460624/buy
GULMOHAR JAIPUR,Women Floral Printed Sequinned Floral Kurta,499,1399,4.3,62,Women Clothing,https://www.myntra.com/kurtas/gulmohar+jaipur/gulmohar-jaipur-women-floral-printed-sequinned-floral-kurta/30236988/buy
Vishudh,yellow Ethnic Motifs Printed Anarkali Gathered Kurta With Trousers & Dupatta,1312,5249,3.5,12,Women Clothing,https://www.myntra.com/kurta-sets/vishudh/vishudh-yellow-ethnic-motifs-printed-anarkali-gathered-kurta-with-trousers--dupatta/30598448/buy
Anouk,Women Beige Pure Cotton Striped Kurta with Palazzos,840,2899,4.3,6,Women Clothing,https://www.myntra.com/kurta-sets/anouk/anouk-women-beige-pure-cotton-striped-kurta-with-palazzos/14399800/buy
Aaghnya,Women Ethnic Embroidered Regular Thread Work Kurta with Trousers & With Dupatta,869,4345,2.8,58,Women Clothing,https://www.myntra.com/kurta-sets/aaghnya/aaghnya-women-ethnic-embroidered-regular-thread-work-kurta-with-trousers--with-dupatta/34747522/buy
Vishudh,Women Yellow Ethnic Motifs Yoke Design Kurta with Trousers & With DupattA,666,2299,4.2,106,Women Clothing,https://www.myntra.com/kurta-sets/vishudh/vishudh-women-yellow-ethnic-motifs-yoke-design-kurta-with-trousers--with-dupatta/19226912/buy
Varanga,Abstract Printed Notch Neck Chanderi Silk Straight Kurta With Trousers,1499,6299,3.7,319,Women Clothing,https://www.myntra.com/kurta-sets/varanga/varanga-abstract-printed-notch-neck-chanderi-silk-straight-kurta-with-trousers/32107442/buy
Sangria,Floral Embroidered Straight Kurta With Trousers & Dupatta,1870,6449,3.5,33,Women Clothing,https://www.myntra.com/kurta-sets/sangria/sangria-floral-embroidered-straight-kurta-with-trousers--dupatta/32314296/buy
Anouk,Mustard Yellow Floral Embroidered Pure Cotton Straight Kurta,560,1699,4.2,53,Women Clothing,https://www.myntra.com/kurtas/anouk/anouk-mustard-yellow-floral-embroidered-pure-cotton-straight-kurta/31594903/buy
TWINS LADY,Floral Embroidered Notch Neck Pure Cotton A-Line Kurta With Trousers & Dupatta,1499,3199,3.7,26,Women Clothing,https://www.myntra.com/kurta-sets/twins+lady/twins-lady-floral-embroidered-notch-neck-pure-cotton-a-line-kurta-with-trousers--dupatta/35122913/buy
KJFAB,Women Pure Cotton Kurta Sets,599,1499,3.9,8,Women Clothing,https://www.myntra.com/kurta-sets/kjfab/kjfab-women-pure-cotton-kurta-sets/36106871/buy
Indo Era,Women Ethnic Motifs Kutch Embroidered Thread Work Kurta,887,2399,4.3,204,Women Clothing,https://www.myntra.com/kurtas/indo+era/indo-era-women-ethnic-motifs-kutch-embroidered-thread-work-kurta/30477174/buy
Janasya,Women's Purple Pure Cotton Ethnic Printed Kurta Set,2599,5999,4.3,756,Women Clothing,https://www.myntra.com/kurta-sets/janasya/janasya-womens-purple-pure-cotton-ethnic-printed-kurta-set/25168030/buy
Anouk,Women Floral Printed Regular Gotta Patti Pure Cotton Kurta with Trousers & Dupatta,1385,4199,4.1,1,Women Clothing,https://www.myntra.com/kurta-sets/anouk/anouk-women-floral-printed-regular-gotta-patti-pure-cotton-kurta-with-trousers--dupatta/25024924/buy
KALINI,Ethnic Motifs Printed Kurta with Trousers & Dupatta,999,4999,4.1,689,Women Clothing,https://www.myntra.com/kurta-sets/kalini/kalini-ethnic-motifs-printed-kurta-with-trousers--dupatta/22974772/buy
Vishudh,Brown Floral Printed Regular Kurta with Trousers & Dupatta,1394,4649,,,Women Clothing,https://www.myntra.com/kurta-sets/vishudh/vishudh-brown-floral-printed-regular-kurta-with-trousers--dupatta/28152828/buy
TRAHIMAM,Women Ethnic Motifs Embroidered Pure Cotton Kurta with Trousers & Dupatta,839,3999,3.2,61,Women Clothing,https://www.myntra.com/kurta-sets/trahimam/trahimam-women-ethnic-motifs-embroidered-pure-cotton-kurta-with-trousers--dupatta/34856236/buy
KALINI,Women Floral Printed Regular Kurta with Trousers & With Dupatta,949,4999,4,615,Women Clothing,https://www.myntra.com/kurta-sets/kalini/kalini-women-floral-printed-regular-kurta-with-trousers--with-dupatta/32556588/buy
aarke Ritu Kumar,Women Floral Printed Regular Kurta with Trousers & With Dupatta,3840,6400,4,29,Women Clothing,https://www.myntra.com/kurta-sets/aarke+ritu+kumar/aarke-ritu-kumar-women-floral-printed-regular-kurta-with-trousers--with-dupatta/24289406/buy
Indo Era,Women Printed Regular Pure Cotton Kurta with Trousers,999,3299,4.1,142,Women Clothing,https://www.myntra.com/kurta-sets/indo+era/indo-era-women-printed-regular-pure-cotton-kurta-with-trousers/31082108/buy
Anouk,Women Floral Printed Floral Anarkali Kurta,923,3299,4.3,4,Women Clothing,https://www.myntra.com/kurtas/anouk/anouk-women-floral-printed-floral-anarkali-kurta/29096468/buy
Vishudh,Women Coral Printed Straight Pure Cotton Kurta with Trousers & Dupatta,869,2999,4.1,407,Women Clothing,https://www.myntra.com/kurta-sets/vishudh/vishudh-women-coral-printed-straight-pure-cotton-kurta-with-trousers--dupatta/18788296/buy
KALINI,Floral Embroidered Regular Sequinned Kurta With Trousers & Dupatta,1790,8950,3.7,5,Women Clothing,https://www.myntra.com/kurta-sets/kalini/kalini-floral-embroidered-regular-sequinned-kurta-with-trousers--dupatta/26511668/buy
VredeVogel,Floral Embroidered Straight Kurta with Trousers & With Dupatta,899,2499,3.6,219,Women Clothing,https://www.myntra.com/kurta-sets/vredevogel/vredevogel-floral-embroidered-straight-kurta-with-trousers--with-dupatta/30776542/buy
Vishudh,Women Teal Embroidered Knited Velvet Kurta with Trousers & Dupatta,1359,4849,4.2,372,Women Clothing,https://www.myntra.com/kurta-sets/vishudh/vishudh-women-teal-embroidered-knited-velvet-kurta-with-trousers--dupatta/21062308/buy
Indo Era,Women Ethnic Motifs Embroidered Regular Liva Kurta with Trousers & With Dupatta,1999,4599,4,161,Women Clothing,https://www.myntra.com/kurta-sets/indo+era/indo-era-women-ethnic-motifs-embroidered-regular-liva-kurta-with-trousers--with-dupatta/31067044/buy
Royal Export,Women Floral Printed Regular Kurta with Trousers & With Dupatta,899,4999,4.1,269,Women Clothing,https://www.myntra.com/kurta-sets/royal+export/royal-export-women-floral-printed-regular-kurta-with-trousers--with-dupatta/30544919/buy
Vishudh,Floral Printed Regular Kurta with Trousers,1348,4649,,,Women Clothing,https://www.myntra.com/kurta-sets/vishudh/vishudh-floral-printed-regular-kurta-with-trousers/27145756/buy
Anouk Rustic,Women Floral Printed Cotton Kurta with Palazzos,999,3999,4.3,36,Women Clothing,https://www.myntra.com/kurta-sets/anouk+rustic/anouk-rustic-women-floral-printed-cotton-kurta-with-palazzos/34799854/buy
Varanga,Women Regular Kurta with Trousers,949,4599,3.4,48,Women Clothing,https://www.myntra.com/kurta-sets/varanga/varanga-women-regular-kurta-with-trousers/34361250/buy
Vishudh,Women Floral Self Design Kurta with Trousers & Dupatta,2141,6299,,,Women Clothing,https://www.myntra.com/kurta-sets/vishudh/vishudh-women-floral-self-design-kurta-with-trousers--dupatta/35450280/buy
Sangria,Brown Floral Embroidered V-Neck A-Line Kurta With Palazzo Set,1399,4999,3.7,155,Women Clothing,https://www.myntra.com/kurta-sets/sangria/sangria-brown-floral-embroidered-v-neck-a-line-kurta-with-palazzo-set/29968784/buy
SINGNI,Ethnic Motifs Printed Mirror Work Anarkali Kurta with Trousers & Dupatta,1169,6499,4,10,Women Clothing,https://www.myntra.com/kurta-sets/singni/singni-ethnic-motifs-printed-mirror-work-anarkali-kurta-with-trousers--dupatta/22339154/buy
Libas,Women Pink Bandhani Printed Gotta Patti Pure Cotton Kurta with Trousers & With Dupatta,999,2999,4.3,8,Women Clothing,https://www.myntra.com/kurta-sets/libas/libas-women-pink-bandhani-printed-gotta-patti-pure-cotton-kurta-with-trousers--with-dupatta/16857684/buy
PHYSIL,Women Printed Regular Calf Length Pure Cotton Straight Kurta with Trousers,699,2499,4,15,Women Clothing,https://www.myntra.com/kurta-sets/physil/physil-women-printed-regular-calf-length-pure-cotton-straight-kurta-with-trousers/35465687/buy
KALINI,Ethnic Motifs Printed Thread Work A-Line Kurta with Trousers And Dupatta,599,5999,3.9,471,Women Clothing,https://www.myntra.com/kurta-sets/kalini/kalini-ethnic-motifs-printed-thread-work--a-line-kurta-with-trousers-and-dupatta/24191354/buy
GoSriKi,Floral Printed V-Neck Straight Kurta With Trousers,703,3197,2.9,440,Women Clothing,https://www.myntra.com/kurta-sets/gosriki/gosriki-floral-printed-v-neck-straight-kurta-with-trousers/32466310/buy
Indo Era,Women Floral Yoke Design Regular Pure Cotton Kurta with Trousers & With Dupatta,1299,5599,3.8,2,Women Clothing,https://www.myntra.com/kurta-sets/indo+era/indo-era-women-floral-yoke-design-regular-pure-cotton-kurta-with-trousers--with-dupatta/26774670/buy
Nayo,Floral Printed Round Neck Pure Cotton Kurta,699,1499,4.3,903,Women Clothing,https://www.myntra.com/kurtas/nayo/nayo-floral-printed-round-neck-pure-cotton-kurta/22158876/buy
Sangria,Embroidered Bandhani Printed V-Neck Anarkali Kurta With Trousers & Dupatta,1844,6149,4.3,364,Women Clothing,https://www.myntra.com/kurta-sets/sangria/sangria-embroidered-bandhani-printed-v-neck-anarkali-kurta-with-trousers--dupatta/28533108/buy
KALINI,Floral Embroidered Sequinned Kurta With Trouser,666,2563,4.4,579,Women Clothing,https://www.myntra.com/kurta-sets/kalini/kalini-floral-embroidered-sequinned-kurta-with-trouser/28181018/buy
Mizaz,Floral Printed Pure Cotton Anarkali Flared Kurta With Trousers & Dupatta,1573,3499,3.9,180,Women Clothing,https://www.myntra.com/kurta-sets/mizaz/mizaz-floral-printed-pure-cotton-anarkali-flared-kurta-with-trousers--dupatta/30456507/buy
Gerua By Libas,Women Floral Yoke Design Regular Sequinned Kurta with Trousers Dupatta,1249,3299,4.4,4,Women Clothing,https://www.myntra.com/kurta-sets/gerua+by+libas/gerua-by-libas-women-floral-yoke-design-regular-sequinned-kurta-with-trousers--dupatta/24473408/buy
Indo Era,Floral Embroidered Sequinned Kurta With Trousers & Dupatta,1699,4799,4.5,351,Women Clothing,https://www.myntra.com/kurta-sets/indo+era/indo-era-floral-embroidered-sequinned-kurta-with-trousers--dupatta/29571354/buy
Libas,Women Yellow & White Printed Kurta with Palazzos & Dupatta,1249,4699,4.2,9,Women Clothing,https://www.myntra.com/kurta-sets/libas/libas-women-yellow--white-printed-kurta-with-palazzos--dupatta/7319923/buy
Nayo,Women Navy Blue Ethnic Printed Cotton Straight Kurta,699,1299,4.2,5,Women Clothing,https://www.myntra.com/kurtas/nayo/nayo-women-navy-blue-ethnic-printed-cotton-straight-kurta-/17631106/buy
