Brand,Product_Name,Price,MRP,Rating,Reviews,Category,URL
KALINI,Floral Embroidered Round Neck Three-Quarter Sleeves Kurta Set,959,3999,4.1,2,Women Clothing,https://www.myntra.com/kurta-sets/kalini/kalini-floral-embroidered-round-neck-three-quarter-sleeves-kurta-set/29338638/buy
LABULY,Plus Size Floral Printed Gotta Patti Straight Kurta,499,1999,4.2,114,Women Clothing,https://www.myntra.com/kurtas/labuly/labuly-plus-size-floral-printed-gotta-patti-straight--kurta/30459985/buy
Tulsattva,Floral Printed Round Neck Thread Work Kurta With Palazzo & Dupatta,1930,4290,4.1,7,Women Clothing,https://www.myntra.com/kurta-sets/tulsattva/tulsattva-floral-printed-round-neck-thread-work-kurta-with-palazzo--dupatta/32798742/buy
Varanga,Floral Embroidered Pleated Cotton A-Line Kurta,949,3599,4.5,61,Women Clothing,https://www.myntra.com/kurtas/varanga/varanga-floral-embroidered-pleated-cotton-a-line-kurta/32303123/buy
Sangria,Floral Printed Pure Cotton Straight Kurta,699,2099,4.1,91,Women Clothing,https://www.myntra.com/kurtas/sangria/sangria-floral-printed-pure-cotton-straight-kurta/33538811/buy
VIBE VISION,Floral Printed Round Neck Straight Kurta With Trousers & Dupatta,883,4399,3.9,148,Women Clothing,https://www.myntra.com/kurta-sets/vibe+vision/vibe-vision-floral-printed-round-neck-straight-kurta-with-trousers--dupatta/33166214/buy
JAPNAAM,Women Embroidered Regular Thread Work Chanderi Silk Kurta & Trousers & Dupatta,1899,4049,,,Women Clothing,https://www.myntra.com/kurta-sets/japnaam/japnaam-women-embroidered-regular-thread-work-chanderi-silk-kurta--trousers--dupatta/34987185/buy
Anouk,Blue Floral Printed Halter Neck Straight Kurta with Trousers & Dupatta,1379,4599,4.4,163,Women Clothing,https://www.myntra.com/kurta-sets/anouk/anouk-blue-floral-printed-halter-neck-straight-kurta-with-trousers--dupatta/30753069/buy
Anouk,Floral Printed Mandarin Collar Straight Kurta,587,2099,4.3,46,Women Clothing,https://www.myntra.com/kurtas/anouk/anouk-floral-printed-mandarin-collar-straight-kurta/33156543/buy
KIMAYRA,Floral Printed Pure Cotton Anarkali Kurta with Palazzos & Dupatta,1499,3799,4.2,25,Women Clothing,https://www.myntra.com/kurta-sets/kimayra/kimayra-floral-printed-pure-cotton-anarkali-kurta-with-palazzos--dupatta/31279027/buy
Libas,Women Floral Printed Kurta with Trousers & Dupatta,2399,6399,4.1,64,Women Clothing,https://www.myntra.com/kurta-sets/libas/libas-women-floral-printed-kurta-with-trousers--dupatta/34138326/buy
Indo Era,Women Ethnic Motifs Printed Regular Thread Work Kurta with Palazzos,1699,3999,,,Women Clothing,https://www.myntra.com/kurta-sets/indo+era/indo-era-women-ethnic-motifs-printed-regular-thread-work-kurta-with-palazzos/34334793/buy
Taavi,Ethnic Motifs Batik Printed Straight Kurta with Trouser & Dupatta,1919,5999,2.9,9,Women Clothing,https://www.myntra.com/kurta-sets/taavi/taavi-ethnic-motifs-batik-printed-straight-kurta-with-trouser--dupatta/33209982/buy
Sangria,Embroidered Regular Gotta Patti Kurta with Palazzos,1399,3999,4.6,172,Women Clothing,https://www.myntra.com/kurta-sets/sangria/sangria-embroidered-regular-gotta-patti-kurta-with-palazzos/30235073/buy
Ramas,Women Floral Printed Sequinned Kurta,932,3329,,,Women Clothing,https://www.myntra.com/kurtas/ramas/ramas-women-floral-printed-sequinned-kurta/33003335/buy
,,,,,,,https://www.myntra.com/kurta-sets/anouk/anouk-white-animal-printed-angrakha-kurta-with-trousers/29174614/buy
,,,,,,,https://www.myntra.com/kurtas/4u+fashion/4u-fashion-women-embroidered-kurta/34924297/buy
Anouk,Zari Round Neck Three-Quarter Sleeves A-Line Kurta,863,2399,4.2,121,Women Clothing,https://www.myntra.com/kurtas/anouk/anouk-zari-round-neck-three-quarter-sleeves--a-line-kurta/27841558/buy
Aaghnya,Women Solid Kurta with Palazzo & Dupatta,869,4345,3.8,87,Women Clothing,https://www.myntra.com/kurta-sets/aaghnya/aaghnya-women-solid-kurta-with-palazzo--dupatta/34480855/buy
Anouk,Mustard Yellow Ethnic Motifs Printed Shirt Collar A-Line Kurta,681,2199,4.4,1,Women Clothing,https://www.myntra.com/kurtas/anouk/anouk-mustard-yellow-ethnic-motifs-printed-shirt-collar-a-line-kurta/28572112/buy
Anouk,Women Floral Embroidered Regular Sequinned Kurta with Trousers & Dupatta,1199,4999,3.4,171,Women Clothing,https://www.myntra.com/kurta-sets/anouk/anouk-women-floral-embroidered-regular-sequinned-kurta-with-trousers--dupatta/25024850/buy
Khushal K,Floral Printed V-Neck Pure Cotton Straight Kurta With Palazzos And Dupatta,1374,5499,4.4,79,Women Clothing,https://www.myntra.com/kurta-sets/khushal+k/khushal-k-floral-printed-v-neck-pure-cotton-straight-kurta-with-palazzos-and-dupatta/33853719/buy
Indo Era,Women Ethnic Motifs Embroidered Regular Velvet Kurta with Trousers & With Dupatta,1749,4799,,,Women Clothing,https://www.myntra.com/kurta-sets/indo+era/indo-era-women-ethnic-motifs-embroidered-regular-velvet-kurta-with-trousers--with-dupatta/31067040/buy
Anouk,Floral Printed Panelled Lace Work Pure Cotton A-Line Kurta With Trousers & Dupatta,1749,6999,3.8,18,Women Clothing,https://www.myntra.com/kurta-sets/anouk/anouk-floral-printed-panelled-lace-work-pure-cotton-a-line-kurta-with-trousers--dupatta/33419635/buy
KALINI,Women Ethnic Motifs Embroidered Regular Sequinned Kurta Sets With Dupatta,956,3299,2.5,13,Women Clothing,https://www.myntra.com/kurta-sets/kalini/kalini-women-ethnic-motifs-embroidered-regular-sequinned-kurta-sets-with-dupatta/33800971/buy
GoSriKi,Bandhani Printed Sequinned Straight Kurta With Trousers & Dupatta,999,4345,3.7,95,Women Clothing,https://www.myntra.com/kurta-sets/gosriki/gosriki-bandhani-printed-sequinned-straight-kurta-with-trousers--dupatta/31263454/buy
Varanga,Floral Printed V-Neck Chanderi Silk A-line Kurta with Trousers,1399,6299,4,185,Women Clothing,https://www.myntra.com/kurta-sets/varanga/varanga-floral-printed-v-neck-chanderi-silk-a-line-kurta-with-trousers-/32107438/buy
Anouk,Women Floral Printed Aari Work Pure Cotton Kurta with Trousers & Dupatta,1889,6999,,,Women Clothing,https://www.myntra.com/kurta-sets/anouk/anouk-women-floral-printed-aari-work-pure-cotton-kurta-with-trousers--dupatta/34476806/buy
Indo Era,Floral Printed Sequinned Shirt Collar A-Line Kurta with Salwar,1499,7999,4.3,716,Women Clothing,https://www.myntra.com/kurta-sets/indo+era/indo-era-floral-printed-sequinned-shirt-collar-a-line-kurta-with-salwar/29325366/buy
CRENOL THREADS,Women Ethnic Motifs Printed Kurta,799,2499,4.1,152,Women Clothing,https://www.myntra.com/kurtas/crenol+threads/crenol-threads-women-ethnic-motifs-printed--kurta/29685788/buy
VredeVogel,Floral Embroidered Beads And Stones Kurta With Trousers & Dupatta,1958,5999,,,Women Clothing,https://www.myntra.com/kurta-sets/vredevogel/vredevogel-floral-embroidered-beads-and-stones-kurta-with-trousers--dupatta/35364511/buy
Sangria,Sequinned A-Line Kurta & Palazzo With Dupatta,1499,4199,3.5,57,Women Clothing,https://www.myntra.com/kurta-sets/sangria/sangria-sequinned-a-line-kurta--palazzo-with-dupatta/34442239/buy
Kohsh,Floral Printed Notch Neck Stone & Bead Work Pure Cotton Kurta with Trouser & Dupatta,1880,5699,3.8,8,Women Clothing,https://www.myntra.com/kurta-sets/kohsh/kohsh-floral-printed-notch-neck-stone--bead-work-pure-cotton-kurta-with-trouser--dupatta/32260085/buy
BKApparels,Paisley Printed Pure Cotton Straight Kurta With Pyjamas,599,2499,3.6,111,Women Clothing,https://www.myntra.com/kurta-sets/bkapparels/bkapparels-paisley-printed-pure-cotton-straight-kurta-with-pyjamas/34884958/buy
Inddus,Women Panelled Kurta with Trousers & With Dupatta,1814,5499,4.1,131,Women Clothing,https://www.myntra.com/kurta-sets/inddus/inddus-women-panelled-kurta-with-trousers--with-dupatta/27770796/buy
Anouk,Mauve Floral Yoke Design Thread Work Straight Kurta With Trousers & Dupatta,1599,4999,4.2,239,Women Clothing,https://www.myntra.com/kurta-sets/anouk/anouk-mauve-floral-yoke-design-thread-work-straight-kurta-with-trousers--dupatta/31981210/buy
HERE&NOW,Ethnic Motifs Print Pure Cotton Kurta with Trousers & Dupatta,1146,3099,4,145,Women Clothing,https://www.myntra.com/kurta-sets/here%26now/herenow-ethnic-motifs-print-pure-cotton-kurta-with-trousers--dupatta/32414470/buy
SZN,Women Floral Printed A-Line Kurta with Trousers,733,1949,4.2,30,Women Clothing,https://www.myntra.com/kurta-sets/szn/szn-women-floral-printed-a-line-kurta-with-trousers/34717060/buy
Sangria,Pink V-Neck Thread Work Pure Cotton Straight Kurta,624,2499,4,151,Women Clothing,https://www.myntra.com/kurtas/sangria/sangria-pink-v-neck-thread-work-pure-cotton-straight-kurta/29708532/buy
SANISA,Women Floral Printed Kurta with Trousers & Dupatta,869,1738,3.8,80,Women Clothing,https://www.myntra.com/kurta-sets/sanisa/sanisa-women-floral-printed-kurta-with-trousers--dupatta/33728612/buy
Libas,Women Paisley Embroidered & Printed Sequins Detailed Kurta,799,2899,4.2,9,Women Clothing,https://www.myntra.com/kurtas/libas/libas-women-paisley-embroidered--printed-sequins-detailed-kurta/35157664/buy
KALINI,Women Floral Printed Regular Pure Cotton Kurta with Trousers & With Dupatta,1199,3999,4.5,53,Women Clothing,https://www.myntra.com/kurta-sets/kalini/kalini-women-floral-printed-regular-pure-cotton-kurta-with-trousers--with-dupatta/32867249/buy
Sangria,Embroidered V-Neck Cotton Silk Anarkali Kurta & Trousers With Dupatta,1399,4997,4,28,Women Clothing,https://www.myntra.com/kurta-sets/sangria/sangria-embroidered-v-neck-cotton-silk-anarkali-kurta--trousers-with-dupatta/33209830/buy
anayna,Women Ethnic Motifs Printed Flared Sleeves Mirror Work Floral Kurta,499,1998,4.3,226,Women Clothing,https://www.myntra.com/kurtas/anayna/anayna-women-ethnic-motifs-printed-flared-sleeves-mirror-work-floral-kurta/30560728/buy
KALINI,Paisley Printed Straight Kurta With Trousers & Dupatta,999,5999,4.2,359,Women Clothing,https://www.myntra.com/kurta-sets/kalini/kalini-paisley-printed-straight-kurta-with-trousers--dupatta/23341654/buy
Sangria,Floral Printed Lace Insert Detail Cuffed Sleeves Straight Kurta,699,1999,3.3,116,Women Clothing,https://www.myntra.com/kurtas/sangria/sangria-floral-printed-lace-insert-detail-cuffed-sleeves-straight-kurta/31624973/buy
KAUTIK FABRICS,Floral Embroidered Thread Work V-Neck Kurta With Trousers & Dupatta,1849,5999,,,Women Clothing,https://www.myntra.com/kurta-sets/kautik+fabrics/kautik-fabrics-floral-embroidered-thread-work-v-neck-kurta-with-trousers--dupatta/36116344/buy
Janasya,Women's Lavender Pure Dobby Cotton Self Design Straight Kurta Pant Set,1699,4248,3.3,46,Women Clothing,https://www.myntra.com/kurta-sets/janasya/janasya-womens-lavender-pure-dobby-cotton-self-design-straight-kurta-pant-set/33039356/buy
GoSriKi,Floral Printed Straight Kurta with Trousers,639,3197,3.2,1,Women Clothing,https://www.myntra.com/kurta-sets/gosriki/gosriki-floral-printed-straight-kurta-with-trousers/31989129/buy
Anouk,Floral Printed Mirror Work Straight Kurta,725,2199,4.3,551,Women Clothing,https://www.myntra.com/kurtas/anouk/anouk-floral-printed-mirror-work-straight-kurta/27896534/buy
Indo Era,Embroidered Panelled Sequinned Kurta with Trousers,999,2999,4.1,43,Women Clothing,https://www.myntra.com/kurta-sets/indo+era/indo-era-embroidered-panelled-sequinned-kurta-with-trousers/30863880/buy
Sangria,Printed Mirror Work Kurta with Sharara,1319,3999,3.6,40,Women Clothing,https://www.myntra.com/kurta-sets/sangria/sangria-printed-mirror-work-kurta-with-sharara/32330235/buy
KALINI,Floral Printed Pure Cotton Anarkali Kurta with Trousers & Dupatta,1393,4999,4.4,5,Women Clothing,https://www.myntra.com/kurta-sets/kalini/kalini-floral-printed-pure-cotton-anarkali-kurta-with-trousers--dupatta/31448024/buy
Nayo,Women Black Ethnic Motifs Printed Pure Cotton Kurta with Palazzos & With Dupatta,1499,3499,4.1,4,Women Clothing,https://www.myntra.com/kurta-sets/nayo/nayo-women-black-ethnic-motifs-printed-pure-cotton-kurta-with-palazzos--with-dupatta/16972006/buy
max,Floral Embroidered V-Neck Regular Straight Kurta,629,699,3.9,41,Women Clothing,https://www.myntra.com/kurtas/max/max-floral-embroidered-v-neck-regular-straight-kurta/30736490/buy
CHANDALIYO,Women Ethnic Motifs Embroidered Regular Kurta with Churidar & With Dupatta,1759,3999,,,Women Clothing,https://www.myntra.com/kurta-sets/chandaliyo/chandaliyo-women-ethnic-motifs-embroidered-regular-kurta-with-churidar--with-dupatta/35152014/buy
Janasya,Women Maroon Pure Cotton Floral Print Flared Kurta,849,2059,3.9,27,Women Clothing,https://www.myntra.com/kurtas/janasya/janasya-women-maroon-pure-cotton-floral-print-flared-kurta/33013737/buy
Sangria,Black Floral Printed Pure Cotton Anarkali Kurta With Trousers & Dupatta,1619,8999,3.7,194,Women Clothing,https://www.myntra.com/kurta-sets/sangria/sangria-black-floral-printed-pure-cotton-anarkali-kurta-with-trousers--dupatta/30901433/buy
VredeVogel,Ethnic Motifs Embroidered Straight Thread Work Kurta with Trousers & Dupatta,1341,4499,4.1,43,Women Clothing,https://www.myntra.com/kurta-sets/vredevogel/vredevogel-ethnic-motifs-embroidered-straight-thread-work-kurta-with-trousers--dupatta/30743100/buy
Gujari,Women Leheriya Printed Floral Maternity Anarkali Kurta,479,2999,3.7,15,Women Clothing,https://www.myntra.com/kurtas/gujari/gujari-women-leheriya-printed-floral-maternity-anarkali-kurta/31714873/buy
KALINI,Women Floral Embroidered Kurta with Trousers & Dupatta,959,3199,4.2,136,Women Clothing,https://www.myntra.com/kurta-sets/kalini/kalini-women-floral-embroidered-kurta-with-trousers--dupatta/33800380/buy
Libas,Women Floral Printed Kurta with Trousers & Dupatta,1449,4649,4.8,5,Women Clothing,https://www.myntra.com/kurta-sets/libas/libas-women-floral-printed-kurta-with-trousers--dupatta/35166368/buy
GoSriKi,Bandhani Printed Straight Kurta With Trouser & Dupatta,899,4345,3.9,328,Women Clothing,https://www.myntra.com/kurta-sets/gosriki/gosriki-bandhani-printed-straight-kurta-with-trouser--dupatta/31972803/buy
Anouk,Women Floral Printed Cotton Kurta with Palazzo,4299,,,,Women Clothing,https://www.myntra.com/kurta-sets/anouk/anouk-women-floral-printed-cotton-kurta-with-palazzo/34985410/buy
GoSriKi,Bandhani Printed Sequinned Embroidery Work Kurta with Trousers & Dupatta,999,4345,3.6,1,Women Clothing,https://www.myntra.com/kurta-sets/gosriki/gosriki-bandhani-printed-sequinned-embroidery-work-kurta-with-trousers--dupatta/30967595/buy
GoSriKi,Women Floral Printed Kurta with Trousers & Dupatta,1099,4345,4.2,6,Women Clothing,https://www.myntra.com/kurta-sets/gosriki/gosriki-women-floral-printed-kurta-with-trousers--dupatta/34753804/buy
Anouk,Shirt Collar Roll-Up Sleeves Pleated A-Line Kurta,824,2499,,,Women Clothing,https://www.myntra.com/kurtas/anouk/anouk-shirt-collar-roll-up-sleeves-pleated-a-line-kurta/34934388/buy
KALINI,Floral Yoke Design Sequinned Cotton Silk Kurta With Trousers & Dupatta,999,7269,3.2,121,Women Clothing,https://www.myntra.com/kurta-sets/kalini/kalini-floral-yoke-design-sequinned-cotton-silk-kurta-with-trousers--dupatta/31048594/buy
Sangria,Printed Pure Cotton A-Line Kurta With Palazzos,1424,4899,4,155,Women Clothing,https://www.myntra.com/kurta-sets/sangria/sangria-printed-pure-cotton-a-line-kurta-with-palazzos/33370770/buy
EXTRA LOVE BY LIBAS,Plus Size Floral Printed Kurta With Trousers & Dupatta,1549,2999,,,Women Clothing,https://www.myntra.com/kurta-sets/extra+love+by+libas/extra-love-by-libas-plus-size-floral-printed-kurta-with-trousers--dupatta/36033498/buy
Anouk Rustic,Women Ethnic Motifs Printed Kurta with Trousers & Dupatta,799,2999,2.9,22,Women Clothing,https://www.myntra.com/kurta-sets/anouk+rustic/anouk-rustic-women-ethnic-motifs-printed-kurta-with-trousers--dupatta/34754970/buy
Gerua By Libas,Women Floral Embroidered Gotta Patti Kurta with Trousers & With Dupatta,1449,5299,4.3,12,Women Clothing,https://www.myntra.com/kurta-sets/gerua+by+libas/gerua-by-libas-women-floral-embroidered-gotta-patti-kurta-with-trousers--with-dupatta/34101987/buy
Indo Era,Women Floral Printed Indie Prints Kurta,699,1799,4.3,261,Women Clothing,https://www.myntra.com/kurtas/indo+era/indo-era-women-floral-printed-indie-prints-kurta/30884044/buy
TOP N THREAD,Women Floral Embroidered Chikankari Kurta,479,2999,4.1,10,Women Clothing,https://www.myntra.com/kurtas/top+n+thread/top-n-thread-women-floral-embroidered-chikankari-kurta/33610262/buy
Sangria,Floral Embroidered Round Neck Sequinned A-Line Kurta With Trousers And Dupatta,2084,6949,,,Women Clothing,https://www.myntra.com/kurta-sets/sangria/sangria-floral-embroidered-round-neck-sequinned-a-line-kurta-with-trousers-and-dupatta/33197118/buy
KALINI,Floral Embroidered Thread Work Pure Cotton Kurta with Trousers & Dupatta,999,5999,4.1,211,Women Clothing,https://www.myntra.com/kurta-sets/kalini/kalini-floral-embroidered-thread-work-pure-cotton-kurta-with-trousers--dupatta/25609124/buy
CREEPER,Women Floral Embroidered Kurta with Palazzo & Dupatta,999,4999,3.2,77,Women Clothing,https://www.myntra.com/kurta-sets/creeper/creeper-women-floral-embroidered-kurta-with-palazzo--dupatta/35677653/buy
GoSriKi,Floral Embroidered Thread Work Anarkali Kurta with Trouser & Dupatta,1098,4345,3.7,170,Women Clothing,https://www.myntra.com/kurta-sets/gosriki/gosriki-floral-embroidered-thread-work-anarkali-kurta-with-trouser--dupatta/31274691/buy
Fashion4word,Ethnic Motifs Printed Thread Work Pure Cotton Kurta With Trousers,749,2499,3.7,84,Women Clothing,https://www.myntra.com/kurta-sets/fashion4word/fashion4word-ethnic-motifs-printed-thread-work-pure-cotton-kurta-with-trousers/33670536/buy
Sangria,Floral Printed V-Neck Beaded Pure Cotton Straight Kurta With Trouser And Dupatta,1599,4499,3.9,15,Women Clothing,https://www.myntra.com/kurta-sets/sangria/sangria-floral-printed-v-neck-beaded-pure-cotton-straight-kurta-with-trouser-and-dupatta/32770643/buy
Anouk,Floral Embroidered Sequinned Empire A-Line Pure Cotton Kurta With Trousers & Dupatta,1439,5999,4,926,Women Clothing,https://www.myntra.com/kurta-sets/anouk/anouk-floral-embroidered-sequinned-empire-a-line-pure-cotton-kurta-with-trousers--dupatta/32672725/buy
TextileNow,Bandhani Printed V-Neck Pleated A-Line Kurta,733,2199,4.1,160,Women Clothing,https://www.myntra.com/kurtas/textilenow/textilenow-bandhani-printed-v-neck-pleated-a-line-kurta/30013330/buy
InWeave,Striped Sleeveless Asymmetric A-Line Kurta With Palazzos,1295,5399,4.4,48,Women Clothing,https://www.myntra.com/kurta-sets/inweave/inweave-striped-sleeveless-asymmetric-a-line-kurta-with-palazzos/30586872/buy
Varanga,Women Floral Embroidered Regular Thread Work Kurta with Trousers,1499,6999,4.1,28,Women Clothing,https://www.myntra.com/kurta-sets/varanga/varanga-women-floral-embroidered-regular-thread-work-kurta-with-trousers/28007980/buy
KALINI,Chevron Printed Shirt Collar A-Line Kurta with Palazzos,719,3999,4.1,1,Women Clothing,https://www.myntra.com/kurta-sets/kalini/kalini-chevron-printed-shirt-collar-a-line-kurta-with-palazzos/30304762/buy
Nayo,Floral Printed V-Neck Pure Cotton Straight Kurta With Trousers & Dupatta,1499,3999,4.2,20,Women Clothing,https://www.myntra.com/kurta-sets/nayo/nayo-floral-printed-v-neck-pure-cotton-straight-kurta-with-trousers--dupatta/33175521/buy
GoSriKi,Women Ethnic Motifs Printed Band Collar A-Line Kurta with Trousers,799,3197,3.3,8,Women Clothing,https://www.myntra.com/kurta-sets/gosriki/gosriki-women-ethnic-motifs-printed-band-collar-a-line-kurta-with-trousers/34306713/buy
Sangria,Embroidered Notch Neck Kurta With Palazzo & Dupatta,1942,6699,4.2,1,Women Clothing,https://www.myntra.com/kurta-sets/sangria/sangria-embroidered-notch-neck-kurta-with-palazzo--dupatta/26717836/buy
GoSriKi,Floral Embroidered Thread Work Straight Kurta With Trousers & Dupatta,1249,4345,3.3,1,Women Clothing,https://www.myntra.com/kurta-sets/gosriki/gosriki-floral-embroidered-thread-work-straight-kurta-with-trousers--dupatta/32000889/buy
Anouk,Women Embroidered Keyhole Neck Flared Sleeves Mirror Work Kurta,679,1999,4.4,5,Women Clothing,https://www.myntra.com/kurtas/anouk/anouk-women-embroidered-keyhole-neck-flared-sleeves-mirror-work-kurta/34530965/buy
KALINI,Bandhani Printed Sequinned Pure Cotton Straight Kurta With Trousers & Dupatta,1499,3999,3.9,221,Women Clothing,https://www.myntra.com/kurta-sets/kalini/kalini-bandhani-printed-sequinned-pure-cotton-straight-kurta-with-trousers--dupatta/32730638/buy
VredeVogel,Floral Embroidered V-Neck Regular Straight Kurta With Trouser With Dupatta,1012,3499,4.1,77,Women Clothing,https://www.myntra.com/kurta-sets/vredevogel/vredevogel-floral-embroidered-v-neck-regular-straight-kurta-with-trouser-with-dupatta/31402210/buy
Sangria,Pink Floral Printed V-Neck Straight Kurta With Trousers,1319,3999,4.1,253,Women Clothing,https://www.myntra.com/kurta-sets/sangria/sangria-pink-floral-printed-v-neck-straight-kurta-with-trousers/30314813/buy
Aaghnya,Floral Printed Round Neck Straight Kurta With Palazzo,636,3197,3.5,417,Women Clothing,https://www.myntra.com/kurta-sets/aaghnya/aaghnya-floral-printed-round-neck-straight-kurta-with-palazzo/34312404/buy
Varanga,Women Ethnic Motifs Embroidered Regular Kurta with Trousers & With Dupatta,1999,8999,4,42,Women Clothing,https://www.myntra.com/kurta-sets/varanga/varanga-women-ethnic-motifs-embroidered-regular-kurta-with-trousers--with-dupatta/28007994/buy
Khushal K,Yoke Or Border Embroidered Regular Anarkali Kurta With Palazzos & Dupatta,1539,5499,3.6,14,Women Clothing,https://www.myntra.com/kurta-sets/khushal+k/khushal-k-yoke-or-border-embroidered-regular-anarkali-kurta-with-palazzos--dupatta/35475419/buy
Yufta,Floral Printed Thread Work Pure Cotton Straight Kurta With Trousers & Dupatta,1799,4499,4.2,191,Women Clothing,https://www.myntra.com/kurta-sets/yufta/yufta-floral-printed-thread-work-pure-cotton-straight-kurta-with-trousers--dupatta/29773038/buy
Indo Era,Floral Printed V-Neck Pleated Pure Cotton A-Line Kurta With Trouser And Dupatta,1699,4799,4.4,26,Women Clothing,https://www.myntra.com/kurta-sets/indo+era/indo-era-floral-printed-v-neck-pleated-pure-cotton-a-line-kurta-with-trouser-and-dupatta/33256637/buy
Aaghnya,Women Ethnic Motifs Yoke Design Kurta with Trousers & Dupatta,929,4345,,,Women Clothing,https://www.myntra.com/kurta-sets/aaghnya/aaghnya-women-ethnic-motifs-yoke-design-kurta-with-trousers--dupatta/34747360/buy
GoSriKi,Women Floral Printed Anarkali Kurta with Palazzos & With Dupatta,1098,4345,,,Women Clothing,https://www.myntra.com/kurta-sets/gosriki/gosriki-women-floral-printed-anarkali-kurta-with-palazzos--with-dupatta/33952869/buy
Anouk,Women Printed Kurta,719,1999,4.4,1,Women Clothing,https://www.myntra.com/kurtas/anouk/anouk-women-printed-kurta/23610162/buy
Sangria,Ethnic Motifs Printed Pure Cotton Straight Kurta With Salwar & Dupatta,1319,3999,4,3,Women Clothing,https://www.myntra.com/kurta-sets/sangria/sangria-ethnic-motifs-printed-pure-cotton-straight-kurta-with-salwar--dupatta/25319442/buy
Poshak Hub,Tiered Anarkali Sweetheart Neck Georgette Kurta With Sharara,1499,4999,4.6,84,Women Clothing,https://www.myntra.com/kurta-sets/poshak+hub/poshak-hub-tiered-anarkali-sweetheart-neck-georgette-kurta-with-sharara/32109959/buy
Aaghnya,Women Printed Viscose Rayon Kurta Sets,869,4345,2.9,12,Women Clothing,https://www.myntra.com/kurta-sets/aaghnya/aaghnya-women-printed-viscose-rayon-kurta-sets/35687685/buy
Varanga,Women Floral Printed Indie Florals Kurta,749,2999,4,38,Women Clothing,https://www.myntra.com/kurtas/varanga/varanga-women-floral-printed-indie-florals-kurta/33082423/buy
Anouk,Blue Floral printed V-Neck Pure Cotton Kurta With Palazzos,1121,3399,3.8,140,Women Clothing,https://www.myntra.com/kurta-sets/anouk/anouk-blue-floral-printed-v-neck-pure-cotton-kurta-with-palazzos/32336760/buy
Anouk,Women Solid Straight Kurta,699,1999,4.2,543,Women Clothing,https://www.myntra.com/kurtas/anouk/anouk-women-solid-straight-kurta/24871718/buy
KALINI,Floral Printed Straight Kurta with Palazzos,790,4160,3.9,38,Women Clothing,https://www.myntra.com/kurta-sets/kalini/kalini-floral-printed-straight-kurta-with-palazzos/32003326/buy
KALINI,Floral Embroidered Round Neck Thread Work Straight Kurta,639,3196,4.3,81,Women Clothing,https://www.myntra.com/kurtas/kalini/kalini-floral-embroidered-round-neck-thread-work-straight-kurta/32020262/buy
Libas,Womens Blue Printed Cotton Anarkali Kurta With Trousers & Dupatta,1549,3499,4.4,125,Women Clothing,https://www.myntra.com/kurta-sets/libas/libas-womens-blue-printed-cotton-anarkali-kurta-with-trousers--dupatta/29233958/buy
Sangria,Women Ethnic Motifs Embroidered Pure Cotton Kurta with Churidar & Dupatta,1787,6163,,,Women Clothing,https://www.myntra.com/kurta-sets/sangria/sangria-women-ethnic-motifs-embroidered-pure-cotton-kurta-with-churidar--dupatta/35581178/buy
Indo Era,Floral Printed Pure Cotton Kurta with Trousers & Dupatta,1499,4599,3.7,24,Women Clothing,https://www.myntra.com/kurta-sets/indo+era/indo-era-floral-printed-pure-cotton-kurta-with-trousers--dupatta/33570778/buy
Indibelle,Floral Printed Mandarin Collar Cotton Anarkali Kurta,750,2999,3.8,24,Women Clothing,https://www.myntra.com/kurtas/indibelle/indibelle-floral-printed-mandarin-collar-cotton-anarkali-kurta/25120012/buy
KALINI,Floral Printed Pure Cotton Kurta with Palazzos & With Dupatta,1007,3599,3.7,238,Women Clothing,https://www.myntra.com/kurta-sets/kalini/kalini-floral-printed-pure-cotton-kurta-with-palazzos--with-dupatta/25164950/buy
max,Women Kurta,699,,4.5,23,Women Clothing,https://www.myntra.com/kurtas/max/max-women-kurta/32528967/buy
FIORRA,Floral Printed Pure Cotton Straight Kurta With Trousers,990,3999,4.4,426,Women Clothing,https://www.myntra.com/kurta-sets/fiorra/fiorra-floral-printed-pure-cotton-straight-kurta-with-trousers/26134850/buy
Tulsattva,Ethnic Motifs Embroidered Anarkali Kurta with Trousers & Dupatta,1654,4725,,,Women Clothing,https://www.myntra.com/kurta-sets/tulsattva/tulsattva-ethnic-motifs-embroidered-anarkali-kurta-with-trousers--dupatta/29015840/buy
KAUTIK FABRICS,Floral Embroidered Sequinned Straight Kurta With Trousers & Dupatta,1799,5999,2.8,5,Women Clothing,https://www.myntra.com/kurta-sets/kautik+fabrics/kautik-fabrics-floral-embroidered-sequinned-straight-kurta-with-trousers--dupatta/34244844/buy
