Brand,Product_Name,Price,MRP,Rating,Reviews,Category,URL
Sangria,Black Floral Printed V-Neck Thread Work Pure Cotton Straight Kurta,650,2099,4.2,2,Women Clothing,https://www.myntra.com/kurtas/sangria/sangria-black-floral-printed-v-neck-thread-work-pure-cotton-straight-kurta/32366596/buy
PARTHVI,Floral Printed V-Neck Pure Cotton Pleated A-Line Kurta With Trousers & Dupatta,719,4799,4.1,343,Women Clothing,https://www.myntra.com/kurta-sets/parthvi/parthvi-floral-printed-v-neck-pure-cotton-pleated-a-line-kurta-with-trousers--dupatta/32681403/buy
Vishudh,Women Regular Kurta with Trousers & With Dupatta,1303,3949,4.3,29,Women Clothing,https://www.myntra.com/kurta-sets/vishudh/vishudh-women-regular-kurta-with-trousers--with-dupatta/32977405/buy
KIMAYRA,Floral Printed Anarkali Pure Cotton Kurta With Palazzos And Dupatta,1399,3599,4.3,2,Women Clothing,https://www.myntra.com/kurta-sets/kimayra/kimayra-floral-printed-anarkali-pure-cotton-kurta-with-palazzos-and-dupatta/32608414/buy
PARTHVI,V-Neck Floral Printed Panelled Pure Cotton Anarkali Kurta with Trouser & Dupatta,671,4799,4.1,1,Women Clothing,https://www.myntra.com/kurta-sets/parthvi/parthvi-v-neck-floral-printed-panelled-pure-cotton-anarkali-kurta-with-trouser--dupatta/31889313/buy
BKApparels,Women Floral Printed Thread Work Pure Cotton Kurta with Pyjamas,599,2499,4.4,571,Women Clothing,https://www.myntra.com/kurta-sets/bkapparels/bkapparels-women-floral-printed-thread-work-pure-cotton-kurta-with-pyjamas/35357063/buy
Sangria,Embroidered Boat-Neck Kurta With Trousers & Dupatta,1994,6649,4.1,7,Women Clothing,https://www.myntra.com/kurta-sets/sangria/sangria-embroidered-boat-neck-kurta-with-trousers--dupatta/27950524/buy
Rimeline,Floral Printed Notch-Neck Straight Kurta,639,1999,4.4,4,Women Clothing,https://www.myntra.com/kurtas/rimeline/rimeline-floral-printed-notch-neck-straight-kurta/32166736/buy
Divena,Women Mustard Yellow & Green Yoke Design A-Line Kurta,1231,2799,4.2,446,Women Clothing,https://www.myntra.com/kurtas/divena/divena-women-mustard-yellow--green-yoke-design-a-line-kurta/10560518/buy
Anouk,Women Floral Embroidered Flared Sleeves Thread Work Kurta,619,1999,4.1,380,Women Clothing,https://www.myntra.com/kurtas/anouk/anouk-women-floral-embroidered-flared-sleeves-thread-work-kurta/33539319/buy
MANOJAVA,Bandhani Printed V-Neck Angrakha Pure Cotton Kurta With Palazzos And Dupatta,1333,2900,4.2,2,Women Clothing,https://www.myntra.com/kurta-sets/manojava/manojava-bandhani-printed-v-neck-angrakha-pure-cotton-kurta-with-palazzos-and-dupatta/32094257/buy
Janasya,Floral Embroidered Georgette Anarkali Kurta with Palazzo & Dupatta,2699,5398,3.9,227,Women Clothing,https://www.myntra.com/kurta-sets/janasya/janasya-floral-embroidered-georgette-anarkali-kurta-with-palazzo--dupatta/30537507/buy
KALINI,Floral Printed V Neck Anarkali Kurta With Trousers & Dupatta,1299,4999,4.3,1,Women Clothing,https://www.myntra.com/kurta-sets/kalini/kalini-floral-printed-v-neck-anarkali-kurta-with-trousers--dupatta/35258270/buy
Anouk,Women Printed Regular Mirror Work Pure Cotton Kurta with Palazzos & With Dupatta,1199,4299,4,324,Women Clothing,https://www.myntra.com/kurta-sets/anouk/anouk-women-printed-regular-mirror-work-pure-cotton-kurta-with-palazzos--with-dupatta/34117630/buy
Janasya,Purple Georgette Embroidered Anarkali Palazzo Set,2799,5398,4.3,123,Women Clothing,https://www.myntra.com/kurta-sets/janasya/janasya-purple-georgette-embroidered-anarkali-palazzo-set/30744433/buy
BKApparels,Women Floral Printed Regular Pure Cotton Kurta with Pyjamas,599,2499,4.2,248,Women Clothing,https://www.myntra.com/kurta-sets/bkapparels/bkapparels-women-floral-printed-regular-pure-cotton-kurta-with-pyjamas/35357032/buy
KALINI,Ethnic Motifs Printed Thread Work Straight Kurta With Trouser & Dupatta,1379,5999,4.3,756,Women Clothing,https://www.myntra.com/kurta-sets/kalini/kalini-ethnic-motifs-printed-thread-work-straight-kurta-with-trouser--dupatta/27475542/buy
Janasya,Women's Green Pure Cotton Geometric A-line Kurta Set,1399,4249,4.1,166,Women Clothing,https://www.myntra.com/kurta-sets/janasya/janasya-womens-green-pure-cotton-geometric-a-line-kurta-set/28965354/buy
GoSriKi,Women Printed Regular Kurta with Palazzos,639,3197,4,3,Women Clothing,https://www.myntra.com/kurta-sets/gosriki/gosriki-women-printed-regular-kurta-with-palazzos/31672323/buy
CHHAAP,V-Neck Straight Kurta With Trousers,1690,4829,4.3,42,Women Clothing,https://www.myntra.com/kurta-sets/chhaap/chhaap-v-neck-straight-kurta-with-trousers/35918951/buy
Vishudh,Floral Printed Regular Kurta with Trousers & With Dupatta,811,2899,4.3,677,Women Clothing,https://www.myntra.com/kurta-sets/vishudh/vishudh-floral-printed-regular-kurta-with-trousers--with-dupatta/22511912/buy
KALINI,Floral Printed Anarkali Kurta With Trousers And Dupatta,949,4999,4,2,Women Clothing,https://www.myntra.com/kurta-sets/kalini/kalini-floral-printed-anarkali-kurta-with-trousers-and-dupatta/32565548/buy
MOKOSH,Floral Embroidered Anarkali Kurta With Trousers & Dupatta,1461,4299,4.3,1,Women Clothing,https://www.myntra.com/kurta-sets/mokosh/mokosh-floral-embroidered-anarkali-kurta-with-trousers--dupatta/32145448/buy
Vishudh,Women Pink & Off-White Printed Kurta with Palazzos,849,2199,3.9,1,Women Clothing,https://www.myntra.com/kurta-sets/vishudh/vishudh-women-pink--off-white-printed-kurta-with-palazzos/13137942/buy
Sangria,Bandhej Printed Kaftan & Tube Top With Sharara,1567,4899,4,970,Women Clothing,https://www.myntra.com/kurta-sets/sangria/sangria-bandhej-printed-kaftan--tube-top-with-sharara/32859228/buy
Rimeline,Ethnic Motifs Printed Pure Cotton Straight Kurta,615,2199,4.2,3,Women Clothing,https://www.myntra.com/kurtas/rimeline/rimeline-ethnic-motifs-printed-pure-cotton-straight-kurta/31214175/buy
Vishudh,Women Straight Jacquard Kurta With Pant & Dupatta,1663,5199,3.3,6,Women Clothing,https://www.myntra.com/kurta-sets/vishudh/vishudh-women-straight-jacquard-kurta-with-pant--dupatta/32086511/buy
KIMAYRA,Women Ethnic Motifs Printed Cotton Anarkali Kurta with Trousers & Dupatta,1399,3599,4.1,777,Women Clothing,https://www.myntra.com/kurta-sets/kimayra/kimayra-women-ethnic-motifs-printed-cotton-anarkali-kurta-with-trousers--dupatta/33729915/buy
Royal Export,Floral Embroidered Regular Thread Work Straight Kurta with Palazzos & Dupatta,1117,5999,4,1,Women Clothing,https://www.myntra.com/kurta-sets/royal+export/royal-export-floral-embroidered-regular-thread-work-straight-kurta-with-palazzos--dupatta/31803818/buy
Vishudh,Women Ethnic Motifs Embroidered Regular Thread Work Kurta with Trousers & With Dupatta,1818,5349,,,Women Clothing,https://www.myntra.com/kurta-sets/vishudh/vishudh-women-ethnic-motifs-embroidered-regular-thread-work-kurta-with-trousers--with-dupatta/32977410/buy
GoSriKi,Women Kurta with Trousers & Dupatta set,825,4345,3.8,6,Women Clothing,https://www.myntra.com/kurta-sets/gosriki/gosriki-women-kurta-with-trousers--dupatta-set/31079027/buy
Sangria,Floral Yoke Printed Mirror Work Kurta,699,2499,4.4,2,Women Clothing,https://www.myntra.com/kurtas/sangria/sangria-floral-yoke-printed-mirror-work-kurta/22057794/buy
Vishudh,Women Solid Viscose Rayon Kurta with Trouser,789,2099,4.1,273,Women Clothing,https://www.myntra.com/kurta-sets/vishudh/vishudh-women-solid-viscose-rayon-kurta-with-trouser/18263672/buy
BKApparels,Women V-Neck Floral Printed Kurta,499,999,4.2,198,Women Clothing,https://www.myntra.com/kurtas/bkapparels/bkapparels-women-v-neck-floral-printed-kurta/35356101/buy
Ginni Arora Label,Women Purple Printed Regular Pure Cotton Kurta with Trousers & With Dupatta,1448,3599,4.2,2,Women Clothing,https://www.myntra.com/kurta-sets/ginni+arora+label/ginni-arora-label-women-purple-printed-regular-pure-cotton-kurta-with-trousers--with-dupatta/15835836/buy
Vishudh,Women Embroidered Straight Kurta with Regular Pants and Organza Dupatta,1697,4849,4,8,Women Clothing,https://www.myntra.com/kurta-sets/vishudh/vishudh-women-embroidered-straight-kurta-with-regular-pants-and-organza-dupatta/32360543/buy
Rimeline,Floral Printed V-Neck Pure Cotton Straight Kurtas,619,1999,4.4,1,Women Clothing,https://www.myntra.com/kurtas/rimeline/rimeline-floral-printed-v-neck-pure-cotton-straight-kurtas/32398898/buy
Sangria,Floral Printed Pure Cotton Straight Kurta With Trouser & Dupatta,1484,5499,4.2,4,Women Clothing,https://www.myntra.com/kurta-sets/sangria/sangria-floral-printed-pure-cotton-straight-kurta-with-trouser--dupatta/25058842/buy
Janasya,Floral Embroidered Keyhole Neck Thread Work Kurta with Trousers & Dupatta,1899,5329,4.2,548,Women Clothing,https://www.myntra.com/kurta-sets/janasya/janasya-floral-embroidered-keyhole-neck-thread-work-kurta-with-trousers--dupatta/28005922/buy
Aaghnya,Women Blue Kurta Sets,929,4345,3,227,Women Clothing,https://www.myntra.com/kurta-sets/aaghnya/aaghnya-women-blue-kurta-sets/35446515/buy
Sangria,Embroidered V-Neck Mirror work Kaftan With Trousers,1349,4999,4.1,1,Women Clothing,https://www.myntra.com/kurta-sets/sangria/sangria-embroidered--v-neck-mirror-work-kaftan-with-trousers/30447928/buy
Vishudh,Women Floral Viscose Rayon Kurta with Trouser with Dupatta,989,2799,3.4,292,Women Clothing,https://www.myntra.com/kurta-sets/vishudh/vishudh-women-floral-viscose-rayon-kurta-with-trouser-with-dupatta/18261856/buy
GoSriKi,Thread Work Anarkali Kurta With Trouser & Dupatta,869,4345,3.2,1,Women Clothing,https://www.myntra.com/kurta-sets/gosriki/gosriki-thread-work-anarkali-kurta-with-trouser--dupatta/31456363/buy
KALINI,Women Ethnic Motifs Printed Floral Anarkali Kurta,924,3299,3.9,463,Women Clothing,https://www.myntra.com/kurtas/kalini/kalini-women-ethnic-motifs-printed-floral-anarkali-kurta/27900446/buy
Vishudh,Blue Printed Yoke Design Thread Work Straight Kurta with Trouser & Dupatta,1544,5149,4.8,5,Women Clothing,https://www.myntra.com/kurta-sets/vishudh/vishudh-blue-printed-yoke-design-thread-work-straight-kurta-with-trouser--dupatta/28152826/buy
Khushal K,Women Embroidered A-Line Kurta with Palazzos & Dupatta,1609,5749,4.7,51,Women Clothing,https://www.myntra.com/kurta-sets/khushal+k/khushal-k-women-embroidered-a-line-kurta-with-palazzos--dupatta/35891156/buy
PRISCA,Floral Printed V-Neck Straight Pure Cotton Kurta With Trousers,599,1299,4,597,Women Clothing,https://www.myntra.com/kurta-sets/prisca/prisca-floral-printed-v-neck-straight-pure-cotton-kurta-with-trousers/34234990/buy
Brownverse,Geometric Yoke Design Thread Work Straight Kurta With Pyjama,1169,2999,4.6,5,Women Clothing,https://www.myntra.com/kurta-sets/brownverse/brownverse-geometric-yoke-design-thread-work-straight-kurta-with-pyjama/30715615/buy
Amayra,Women White Kurta Sets,999,2999,3.1,16,Women Clothing,https://www.myntra.com/kurta-sets/amayra/amayra-women-white-kurta-sets/35292799/buy
KALINI,Floral Printed Straight Kurta With Trousers & Dupatta,781,3399,3.8,1,Women Clothing,https://www.myntra.com/kurta-sets/kalini/kalini-floral-printed-straight-kurta-with-trousers--dupatta/30259660/buy
Vishudh,Mandarin Collar Regular Kurta with Trousers & Dupatta,1091,3899,,,Women Clothing,https://www.myntra.com/kurta-sets/vishudh/vishudh-mandarin-collar-regular-kurta-with-trousers--dupatta/26851990/buy
anayna,Geometric Printed V-Neck Pure Cotton Straight Kurta,498,1998,4.2,1,Women Clothing,https://www.myntra.com/kurtas/anayna/anayna-geometric-printed-v-neck-pure-cotton-straight-kurta/30494195/buy
Larqi,Floral Embroidered Sequinned Pure Cotton Kurta With Trousers & Dupatta,1985,3970,,,Women Clothing,https://www.myntra.com/kurta-sets/larqi/larqi-floral-embroidered-sequinned-pure-cotton-kurta-with-trousers--dupatta/36198744/buy
KALINI,Floral Printed Anarkali Pure Cotton Kurta with Trousers & Dupatta,1243,7299,4.4,18,Women Clothing,https://www.myntra.com/kurta-sets/kalini/kalini-floral-printed-anarkali-pure-cotton-kurta-with-trousers--dupatta/25234310/buy
PHYSIL,Women Ethnic Motifs Printed Pure Cotton V-Neck A-Line Kurta,499,1499,3.7,88,Women Clothing,https://www.myntra.com/kurtas/physil/physil-women-ethnic-motifs-printed-pure-cotton-v-neck-a-line-kurta/35197961/buy
Vishudh,Green Printed Yoke Design Thread Work Straight Kurta with Trouser & Dupatta,1802,5149,,,Women Clothing,https://www.myntra.com/kurta-sets/vishudh/vishudh-green-printed-yoke-design-thread-work-straight-kurta-with-trouser--dupatta/28152842/buy
Aaghnya,Women Solid Viscose Rayon Kurta Sets,799,3197,3.6,114,Women Clothing,https://www.myntra.com/kurta-sets/aaghnya/aaghnya-women-solid-viscose-rayon-kurta-sets/35687702/buy
Vishudh,Women Lime Embroidered Straight Kurta with Regular Pants and Organza Dupatta,1697,4849,,,Women Clothing,https://www.myntra.com/kurta-sets/vishudh/vishudh-women-lime-embroidered-straight-kurta-with-regular-pants-and-organza-dupatta/32376360/buy
Sangria,Purple & Gold Toned Zari Embroidered Straight Kurta With Trouser & Dupatta,1539,5499,3.9,667,Women Clothing,https://www.myntra.com/kurta-sets/sangria/sangria-purple--gold-toned-zari-embroidered-straight-kurta-with-trouser--dupatta/27157090/buy
Vishudh,Women Pink Kurta with Trousers & With Dupatta,917,2699,3.8,243,Women Clothing,https://www.myntra.com/kurta-sets/vishudh/vishudh-women-pink-kurta-with-trousers--with-dupatta/18688422/buy
anayna,Women Ethnic Motifs Printed Kurta,498,1998,4.3,1,Women Clothing,https://www.myntra.com/kurtas/anayna/anayna-women-ethnic-motifs-printed-kurta/26972236/buy
Vishudh,Women Embroidered Straight Sleeveless Kurta Set with Slim Pants and Tissue Dupatta,2303,7199,4,11,Women Clothing,https://www.myntra.com/kurta-sets/vishudh/vishudh-women-embroidered-straight-sleeveless-kurta-set-with-slim-pants-and-tissue-dupatta/32611593/buy
GULMOHAR JAIPUR,Floral Embroidered V-Neck Anarkali Kurta,799,1799,4.4,54,Women Clothing,https://www.myntra.com/kurtas/gulmohar+jaipur/gulmohar-jaipur-floral-embroidered-v-neck-anarkali-kurta/33038931/buy
Vishudh,Floral Embroidered Regular Kurta with Trousers,1751,5649,,,Women Clothing,https://www.myntra.com/kurta-sets/vishudh/vishudh-floral-embroidered-regular-kurta-with-trousers/27145660/buy
Sangria,Burgundy Floral Printed V-Neck Straight Kurta With Trousers,1119,3999,4.1,228,Women Clothing,https://www.myntra.com/kurta-sets/sangria/sangria-burgundy-floral-printed-v-neck-straight-kurta-with-trousers/30314814/buy
KALINI,Floral Printed Round Neck Anarkali Kurta With Trousers & Dupatta,949,4999,4.2,467,Women Clothing,https://www.myntra.com/kurta-sets/kalini/kalini-floral-printed-round-neck-anarkali-kurta-with-trousers--dupatta/33193616/buy
Vishudh,Women Printed Kurta with Bottom and Dupatta,1994,5249,,,Women Clothing,https://www.myntra.com/kurta-sets/vishudh/vishudh-women-printed-kurta-with-bottom-and-dupatta/32611603/buy
PHYSIL,Women Floral Printed Thread Work Kurta,499,1499,3.7,112,Women Clothing,https://www.myntra.com/kurtas/physil/physil-women-floral-printed-thread-work-kurta/35197962/buy
Vishudh,Black Floral Printed Regular Kurta With Trousers & Dupatta,1435,4349,4.1,15,Women Clothing,https://www.myntra.com/kurta-sets/vishudh/vishudh-black-floral-printed-regular-kurta-with-trousers--dupatta/26620544/buy
PHYSIL,Women Floral Printed Regular Aline Calf Length Kurta with Trousers,599,2499,3.8,560,Women Clothing,https://www.myntra.com/kurta-sets/physil/physil-women-floral-printed-regular-aline-calf-length-kurta-with-trousers/34042340/buy
Sangria,Green Floral Embroidered V Neck Anarkali Kurta With Trouser & Dupatta,1714,6349,4.1,147,Women Clothing,https://www.myntra.com/kurta-sets/sangria/sangria-green-floral-embroidered-v-neck-anarkali-kurta-with-trouser--dupatta/30617428/buy
Vishudh,Women Purple Panelled Kurti with Skirt & With Jacket,1219,3949,4,914,Women Clothing,https://www.myntra.com/kurta-sets/vishudh/vishudh-women-purple-panelled-kurti-with-skirt--with-jacket/18788308/buy
Anouk,Maroon Ethnic Motifs Embroidered Round Neck Thread Work Straight Kurta,774,2499,4.3,1,Women Clothing,https://www.myntra.com/kurtas/anouk/anouk-maroon-ethnic-motifs-embroidered-round-neck-thread-work-straight-kurta/30104320/buy
Anouk,Floral Printed Panelled V-Neck Pure Cotton A-Line Kurta With Palazzos & Dupatta,1749,6999,3.9,101,Women Clothing,https://www.myntra.com/kurta-sets/anouk/anouk-floral-printed-panelled-v-neck-pure-cotton-a-line-kurta-with-palazzos--dupatta/33419571/buy
Vishudh,Women Ethnic Motifs Regular Kurta with Trousers & With Dupatta,1633,4949,,,Women Clothing,https://www.myntra.com/kurta-sets/vishudh/vishudh-women-ethnic-motifs-regular-kurta-with-trousers--with-dupatta/31668664/buy
FIORRA,Women Floral Printed Cotton Kurta with Trousers,1214,3799,4.2,154,Women Clothing,https://www.myntra.com/kurta-sets/fiorra/fiorra-women-floral-printed-cotton-kurta-with-trousers/33826799/buy
Varanga,Maroon Zari Work textured Kurta with Trouser and Printed Dupatta,999,5599,4,1,Women Clothing,https://www.myntra.com/kurta-sets/varanga/varanga-maroon-zari-work-textured-kurta-with-trouser-and-printed-dupatta/28727166/buy
Larqi,Floral Embroidered V-Neck Patchwork Pure Cotton Kurta With Trousers & Dupatta,1985,3970,,,Women Clothing,https://www.myntra.com/kurta-sets/larqi/larqi-floral-embroidered-v-neck-patchwork-pure-cotton-kurta-with-trousers--dupatta/36198737/buy
Libas,Women Black Pure Cotton Yoke Design Panelled Kurta with Palazzos & Dupatta,1249,3499,4.3,12,Women Clothing,https://www.myntra.com/kurta-sets/libas/libas-women-black-pure-cotton-yoke-design-panelled-kurta-with-palazzos--dupatta/15055280/buy
GoSriKi,Floral Printed Round Neck Anarkali Kurta With Trousers & Dupatta,1097,4345,3.6,1,Women Clothing,https://www.myntra.com/kurta-sets/gosriki/gosriki-floral-printed-round-neck-anarkali-kurta-with-trousers--dupatta/30800798/buy
Vishudh,Ethnic Motifs Embroidered Regular Thread Work Kurta with Trousers & With Dupatta,1377,4749,4,5,Women Clothing,https://www.myntra.com/kurta-sets/vishudh/vishudh-ethnic-motifs-embroidered-regular-thread-work-kurta-with-trousers--with-dupatta/27145648/buy
Yufta,Floral Printed Pure Cotton Maternity Anarkali Kurta With Trousers & Dupatta,1899,4999,4.4,30,Women Clothing,https://www.myntra.com/kurta-sets/yufta/yufta-floral-printed-pure-cotton-maternity-anarkali-kurta-with-trousers--dupatta/32631972/buy
KJFAB,Women Floral Printed Regular Pure Cotton Kurta with Harem Pants,599,1499,4.1,159,Women Clothing,https://www.myntra.com/kurta-sets/kjfab/kjfab-women-floral-printed-regular-pure-cotton-kurta-with-harem-pants/35554117/buy
Larqi,Women Floral Embroidered Regular Pure Cotton Kurta with Trousers & With Dupatta,1985,3970,,,Women Clothing,https://www.myntra.com/kurta-sets/larqi/larqi-women-floral-embroidered-regular-pure-cotton-kurta-with-trousers--with-dupatta/36198740/buy
Sangria,Women Floral Embroidered Anarkali Kurta with Trousers & Dupatta,1512,6049,4.7,13,Women Clothing,https://www.myntra.com/kurta-sets/sangria/sangria-women-floral-embroidered-anarkali-kurta-with-trousers--dupatta/35293992/buy
Royal Export,Floral Embroidered Sequinned Kurta with Trouser & Dupatta,879,5499,3.6,460,Women Clothing,https://www.myntra.com/kurta-sets/royal+export/royal-export-floral-embroidered-sequinned-kurta-with-trouser--dupatta/31874434/buy
Vishudh,Floral Embroidered Regular Thread Work Pure Cotton Kurta with Palazzos,1949,6449,,,Women Clothing,https://www.myntra.com/kurta-sets/vishudh/vishudh-floral-embroidered-regular-thread-work-pure-cotton-kurta-with-palazzos/30612526/buy
Anouk,Women Floral Printed Regular Pure Cotton Kurta with Trousers & With Dupatta,956,3299,4.2,2,Women Clothing,https://www.myntra.com/kurta-sets/anouk/anouk-women-floral-printed-regular-pure-cotton-kurta-with-trousers--with-dupatta/32817851/buy
KALINI,Floral Embroidered Thread Work A-Line Kurta With Trousers & Dupatta,1647,4225,3.4,1,Women Clothing,https://www.myntra.com/kurta-sets/kalini/kalini-floral-embroidered-thread-work-a-line-kurta-with-trousers--dupatta/31147990/buy
Vishudh,Ethnic Motifs Printed Regular Thread Work Kurta With Trousers,1049,3749,,,Women Clothing,https://www.myntra.com/kurta-sets/vishudh/vishudh-ethnic-motifs-printed-regular-thread-work-kurta-with-trousers/26851962/buy
GoSriKi,Ethnic Motifs Embroidered Kurta & Trousers With Dupatta,825,4345,3.9,867,Women Clothing,https://www.myntra.com/kurta-sets/gosriki/gosriki-ethnic-motifs-embroidered-kurta--trousers-with-dupatta/25405706/buy
Yufta,Floral Printed Empire Pure Cotton Maternity Anarkali Kurta With Trouser & Dupatta,1899,4999,4.3,23,Women Clothing,https://www.myntra.com/kurta-sets/yufta/yufta-floral-printed-empire-pure-cotton-maternity-anarkali-kurta-with-trouser--dupatta/32631960/buy
Larqi,Women Floral Embroidered Cotton Kurta with Trousers & Dupatta,1985,3970,,,Women Clothing,https://www.myntra.com/kurta-sets/larqi/larqi-women-floral-embroidered-cotton-kurta-with-trousers--dupatta/36198741/buy
Sangria,Floral Printed Floral Chanderi Silk Kurta,874,2499,4.2,205,Women Clothing,https://www.myntra.com/kurtas/sangria/sangria-floral-printed-floral-chanderi-silk-kurta/31656950/buy
Indo Era,Ethnic Motifs Embroidered Thread Work Kurta With Trousers & Dupatta,1899,6999,4,1,Women Clothing,https://www.myntra.com/kurta-sets/indo+era/indo-era-ethnic-motifs-embroidered-thread-work-kurta-with-trousers--dupatta/27580842/buy
Anouk Rustic,Floral Printed V-Neck Straight Kurta with Trousers & Dupatta,3099,,,,Women Clothing,https://www.myntra.com/kurta-sets/anouk+rustic/anouk-rustic-floral-printed-v-neck-straight-kurta-with-trousers--dupatta/33662042/buy
Libas,Floral Embroidered Panelled Thread Work A-Line Kurta With Salwar & Dupatta,1399,4499,4,134,Women Clothing,https://www.myntra.com/kurta-sets/libas/libas-floral-embroidered-panelled-thread-work-a-line-kurta-with-salwar--dupatta/30572926/buy
Varanga,Women Printed Regular Chanderi Silk Kurta with Trousers & Dupatta,1599,6999,4.1,217,Women Clothing,https://www.myntra.com/kurta-sets/varanga/varanga-women-printed-regular-chanderi-silk-kurta-with-trousers--dupatta/24362730/buy
Anouk Rustic,Floral Printed Kurta With Trousers & Dupatta,3099,,,,Women Clothing,https://www.myntra.com/kurta-sets/anouk+rustic/anouk-rustic-floral-printed-kurta-with-trousers--dupatta/33612610/buy
KALINI,Floral Printed Regular Cotton Blend Kurta with Trousers With Dupatta,783,2799,3.9,589,Women Clothing,https://www.myntra.com/kurta-sets/kalini/kalini-floral-printed-regular-cotton-blend-kurta-with-trousers-with-dupatta/30652811/buy
Ashlee,Floral Printed Pleated Cotton Anarkali Kurta,749,1499,4.5,164,Women Clothing,https://www.myntra.com/kurtas/ashlee/ashlee-floral-printed-pleated-cotton-anarkali-kurta/31567866/buy
Anouk Rustic,Floral Printed Straight Kurta With Trousers & Dupatta,3099,,,,Women Clothing,https://www.myntra.com/kurta-sets/anouk+rustic/anouk-rustic-floral-printed-straight-kurta-with-trousers--dupatta/33612567/buy
Anouk,Floral Embroidered Round Neck Chikankari Straight Kurta,959,2999,4.5,209,Women Clothing,https://www.myntra.com/kurtas/anouk/anouk-floral-embroidered-round-neck-chikankari-straight-kurta/29965161/buy
Janasya,Women's Off White Pure Cotton Floral Printed A-line Maternity Kurta,999,2698,4.3,80,Women Clothing,https://www.myntra.com/kurtas/janasya/janasya-womens-off-white-pure-cotton-floral-printed-a-line-maternity-kurta/33013736/buy
SILAKIVA,Floral Printed Round Neck Tiered Anarkali Maternity Kurta,579,2999,4.1,22,Women Clothing,https://www.myntra.com/kurtas/silakiva/silakiva-floral-printed-round-neck-tiered-anarkali-maternity-kurta/32280978/buy
KALINI,Women Green Viscose Rayon Kurta Sets,799,2999,4,71,Women Clothing,https://www.myntra.com/kurta-sets/kalini/kalini-women-green-viscose-rayon-kurta-sets/34659827/buy
WOMEN PLUS,Embroidered Regular Thread Work Kurta with Trousers & Dupatta,1299,4599,4.2,26,Women Clothing,https://www.myntra.com/kurta-sets/women+plus/women-plus-embroidered-regular-thread-work-kurta-with-trousers--dupatta/29980881/buy
InWeave,Checked Flared Sleeves V-Neck Cotton A-Line Kurta,681,2199,3.9,90,Women Clothing,https://www.myntra.com/kurtas/inweave/inweave-checked-flared-sleeves-v-neck-cotton-a-line-kurta/32217873/buy
Inddus,Women Mauve Net Floral Embroidered Sequinned Kurta with Palazzos & Dupatta,1994,5699,4.4,2,Women Clothing,https://www.myntra.com/kurta-sets/inddus/inddus-women-mauve-net-floral-embroidered-sequinned-kurta-with-palazzos--dupatta/14224834/buy
Vishudh,Women Ethnic Motifs Embroidered Kurta with Patiala & Dupatta,2449,6999,,,Women Clothing,https://www.myntra.com/kurta-sets/vishudh/vishudh-women-ethnic-motifs-embroidered-kurta-with-patiala--dupatta/35450255/buy
Khushal K,Ethnic Motifs Printed V-Neck Pure Cotton A-Line Kurta with Palazzos & Dupatta,1715,6599,4.3,3,Women Clothing,https://www.myntra.com/kurta-sets/khushal+k/khushal-k-ethnic-motifs-printed-v-neck-pure-cotton-a-line-kurta-with-palazzos--dupatta/30086165/buy
Larqi,Women Abstract Printed Regular Pure Cotton Kurta with Trousers,1047,1940,,,Women Clothing,https://www.myntra.com/kurta-sets/larqi/larqi-women-abstract-printed-regular-pure-cotton-kurta-with-trousers/35289657/buy
GoSriKi,Women Regular A-Line Kurta With Trousers,899,3197,3.2,281,Women Clothing,https://www.myntra.com/kurta-sets/gosriki/gosriki-women-regular-a-line-kurta-with-trousers/35153700/buy
Women Basket,Women Bandhani Regular Kurta with Trousers,699,2299,3.8,10,Women Clothing,https://www.myntra.com/kurta-sets/women+basket/women-basket-women-bandhani-regular-kurta-with-trousers/34774944/buy
Janasya,Women Sky Blue Pure Cotton Ethnic Motifs Printed Straight Kurta Pant Set,1499,3498,4.6,49,Women Clothing,https://www.myntra.com/kurta-sets/janasya/janasya-women-sky-blue-pure-cotton-ethnic-motifs-printed-straight-kurta-pant-set/33011535/buy
Mizaz,Ethnic Motifs Printed Pure Cotton Mirror Work A-line Kurta & Trousers With Dupatta,1328,3499,4.2,841,Women Clothing,https://www.myntra.com/kurta-sets/mizaz/mizaz-ethnic-motifs-printed-pure-cotton-mirror-work-a-line-kurta--trousers-with-dupatta/24685114/buy
Aaghnya,Women Geometric Printed Kurta with Palazzo,699,3197,4.2,614,Women Clothing,https://www.myntra.com/kurta-sets/aaghnya/aaghnya-women-geometric-printed-kurta-with-palazzo/34714613/buy
