Brand,Product_Name,Price,MRP,Rating,Reviews,Category,URL
Sangria,Yoke Design Sequinned V-Neck A-Line Kurta with Dhoti & Dupatta Set,1619,5999,,,Women Clothing,https://www.myntra.com/kurta-sets/sangria/-sangria-yoke-design-sequinned-v-neck-a-line-kurta-with-dhoti--dupatta-set/34958787/buy
anayna,Floral Printed Sweetheart Neck Straight Kurta With Trousers,1299,4350,4.4,551,Women Clothing,https://www.myntra.com/kurta-sets/anayna/anayna-floral-printed-sweetheart-neck-straight-kurta-with-trousers/31888695/buy
Sangria,Women Chikankari Embroidered Round Neck Kurta,735,3196,4.3,158,Women Clothing,https://www.myntra.com/kurtas/sangria/sangria-women-chikankari-embroidered-round-neck-kurta/29673698/buy
Khushal K,Ethnic Motifs Regular Sequinned A Line Kurta with Palazzos & Dupatta,1598,6149,4,24,Women Clothing,https://www.myntra.com/kurta-sets/khushal+k/khushal-k-ethnic-motifs-regular-sequinned-a-line-kurta-with-palazzos--dupatta/30856410/buy
The Hope,Women Embroidered Regular Thread Work Pure Cotton Kurta with Palazzos,865,1999,4.4,153,Women Clothing,https://www.myntra.com/kurta-sets/the+hope/the-hope-women-embroidered-regular-thread-work-pure-cotton-kurta-with-palazzos/32904496/buy
HOUSE OF JAMOTI,Pikes Spades Printed Mandarin Collar Pure Cotton Straight Kurta & Salwar,1719,3125,2.7,66,Women Clothing,https://www.myntra.com/kurta-sets/house+of+jamoti/house-of-jamoti-pikes-spades-printed-mandarin-collar-pure-cotton-straight-kurta--salwar/31393050/buy
Libas,Ethnic Motifs Embroidered Zari A Line Kurta with Palazzos & Dupatta,1999,5999,4.3,118,Women Clothing,https://www.myntra.com/kurta-sets/libas/libas-ethnic-motifs-embroidered-zari-a-line-kurta-with-palazzos--dupatta/30869683/buy
Anouk,Floral Printed Band Collar Chanderi Silk Straight Kurta,639,1999,4,1,Women Clothing,https://www.myntra.com/kurtas/anouk/anouk-floral-printed-band-collar-chanderi-silk-straight-kurta/30597511/buy
DIVASTRI,Floral Printed V-Neck Straight Kurta,395,999,3.8,296,Women Clothing,https://www.myntra.com/kurtas/divastri/divastri-floral-printed-v-neck-straight--kurta/33714512/buy
Anouk,Ethnic Motifs Notch Neck Pure Cotton Straight Kurta,949,2599,4.4,19,Women Clothing,https://www.myntra.com/kurtas/anouk/anouk-ethnic-motifs-notch-neck-pure-cotton-straight-kurta-/32745569/buy
Poshak Hub,Women Maroon Ethnic Motifs Embellished Georgette Anarkali Kurta,944,3499,4.5,954,Women Clothing,https://www.myntra.com/kurtas/poshak+hub/poshak-hub-women-maroon-ethnic-motifs-embellished-georgette-anarkali-kurta/17351462/buy
Anouk,Olive Round Neck Straight Curved Pleated Kurta With Trouser,979,3499,4,587,Women Clothing,https://www.myntra.com/kurta-sets/anouk/anouk-olive-round-neck-straight-curved-pleated-kurta-with-trouser/27318048/buy
KALINI,Floral Printed Gotta Patti Pure Cotton Kurta with Trousers & Dupatta,999,5999,4.2,1,Women Clothing,https://www.myntra.com/kurta-sets/kalini/kalini-floral-printed-gotta-patti-pure-cotton-kurta-with-trousers--dupatta/22974734/buy
KJFAB,Women Blue Pure Cotton Kurta Sets,599,1499,4.2,79,Women Clothing,https://www.myntra.com/kurta-sets/kjfab/kjfab-women-blue-pure-cotton-kurta-sets/35529459/buy
Anouk,Floral Printed Regular Sequinned Pure Cotton Kurta With Trousers & Dupatta,1854,5299,4.7,15,Women Clothing,https://www.myntra.com/kurta-sets/anouk/anouk-floral-printed-regular-sequinned-pure-cotton-kurta-with-trousers--dupatta/32009437/buy
KALINI,Floral Printed Pleated V-Neck A-Line Kurta With Palazzos And Dupatta,949,4999,4.1,365,Women Clothing,https://www.myntra.com/kurta-sets/kalini/kalini-floral-printed-pleated-v-neck-a-line-kurta-with-palazzos-and-dupatta/32565308/buy
Anouk,Burgundy Ethnic Motifs Printed Mandarin Collar Kurta,607,1899,4.2,182,Women Clothing,https://www.myntra.com/kurtas/anouk/anouk-burgundy-ethnic-motifs-printed-mandarin-collar-kurta/30049022/buy
Sangria,Floral Printed Mandarin Collar Three-Quarter Sleeves Straight Kurta,439,1999,,,Women Clothing,https://www.myntra.com/kurtas/sangria/sangria-floral-printed-mandarin-collar-three-quarter-sleeves-straight-kurta/32770502/buy
Anouk,Floral Yoke Design Notch Neck Thread Work Straight Kurta,619,1999,4.2,44,Women Clothing,https://www.myntra.com/kurtas/anouk/anouk-floral-yoke-design-notch-neck-thread-work-straight-kurta/33539317/buy
Varanga,Women Regular Silk Crepe Kurta with Trousers,1249,5599,4.2,482,Women Clothing,https://www.myntra.com/kurta-sets/varanga/varanga-women-regular-silk-crepe-kurta-with-trousers/28727176/buy
Sangria,Alina Cut Floral Embroidered V-Neck Kurta With Palazzo,1646,6099,4.1,212,Women Clothing,https://www.myntra.com/kurta-sets/sangria/sangria-alina-cut-floral-embroidered-v-neck-kurta-with-palazzo/29375384/buy
anayna,Women Ethnic Motifs Printed Regular Sequinned Kurta with Trousers,1299,4350,4.3,2,Women Clothing,https://www.myntra.com/kurta-sets/anayna/anayna-women-ethnic-motifs-printed-regular-sequinned-kurta-with-trousers/24865776/buy
Yufta,Women Beige & Blue Printed Kurta with Palazzos,999,2199,4.2,5,Women Clothing,https://www.myntra.com/kurta-sets/yufta/yufta-women-beige--blue-printed-kurta-with-palazzos/6601271/buy
Anouk,V-Neck Three-Quarter Sleeves Panelled Kurta with Trousers,1199,3999,4.2,423,Women Clothing,https://www.myntra.com/kurta-sets/anouk/anouk-v-neck-three-quarter-sleeves-panelled-kurta-with-trousers/29179162/buy
Indo Era,Floral Embroidered Pure Cotton Kurta with Trousers,1499,4399,4.2,22,Women Clothing,https://www.myntra.com/kurta-sets/indo+era/indo-era-floral-embroidered-pure-cotton-kurta-with-trousers/32831705/buy
Anouk,Women Ethnic Motifs Printed Regular Pure Cotton Kurta with Trousers & With Dupatta,956,3299,4.1,194,Women Clothing,https://www.myntra.com/kurta-sets/anouk/anouk-women-ethnic-motifs-printed-regular-pure-cotton-kurta-with-trousers--with-dupatta/32817832/buy
Indo Era,Floral Yoke Design Thread Work A-Line Kurta With Trousers & Dupatta,1999,6999,4,662,Women Clothing,https://www.myntra.com/kurta-sets/indo+era/indo-era-floral-yoke-design-thread-work-a-line-kurta-with-trousers--dupatta/24838934/buy
Henal,Floral Printed Maternity Anarkali Kurta,689,2999,4.1,305,Women Clothing,https://www.myntra.com/kurtas/henal/henal-floral-printed-maternity-anarkali-kurta/26691834/buy
Anouk,Floral Embroidered Regular Thread Work Straight Kurta with Trousers & Dupatta,1739,5799,4,66,Women Clothing,https://www.myntra.com/kurta-sets/anouk/anouk-floral-embroidered-regular-thread-work-straight-kurta-with-trousers--dupatta/30475316/buy
Anouk,Women Floral Print Shirt Collar Cotton Kurta,579,1999,4.3,357,Women Clothing,https://www.myntra.com/kurtas/anouk/anouk-women-floral-print-shirt-collar-cotton-kurta/25024954/buy
PHYSIL,Floral Printed Notch Neck Pure Cotton Straight Kurta with Trousers,599,2499,4.2,601,Women Clothing,https://www.myntra.com/kurta-sets/physil/physil-floral-printed-notch-neck-pure-cotton-straight-kurta-with-trousers/32232893/buy
Jaipur Kurti,Women Embroidered Chanderi Silk Kurta,529,1899,3.3,24,Women Clothing,https://www.myntra.com/kurtas/jaipur+kurti/jaipur-kurti-women-embroidered-chanderi-silk-kurta/33843704/buy
Sangria,Zari Embroidered Notch Neck A-Line Kurta & Trousers,1833,6549,3.8,18,Women Clothing,https://www.myntra.com/kurta-sets/sangria/sangria-zari-embroidered-notch-neck-a-line-kurta--trousers/32725867/buy
GoSriKi,Bandhani Printed Mirror Work Straight Kurta With Trouser & Dupatta,999,4345,3.7,932,Women Clothing,https://www.myntra.com/kurta-sets/gosriki/gosriki-bandhani-printed-mirror-work-straight-kurta-with-trouser--dupatta/31171014/buy
Libas,Floral Printed Mandarin Collar Straight Kurta With Trousers,1199,2799,4.4,63,Women Clothing,https://www.myntra.com/kurta-sets/libas/libas-floral-printed-mandarin-collar-straight-kurta-with-trousers/32599124/buy
Sangria,Floral Embroidered V-Neck Sequinned Straight Kurta With Pant And Dupatta,1823,5699,,,Women Clothing,https://www.myntra.com/kurta-sets/sangria/sangria-floral-embroidered-v-neck-sequinned-straight-kurta-with-pant-and-dupatta/35975590/buy
BKApparels,Women Floral Printed Thread Work Detail Pure Cotton A -Line Kurta,499,999,4.1,86,Women Clothing,https://www.myntra.com/kurtas/bkapparels/bkapparels-women-floral-printed-thread-work-detail-pure-cotton-a--line-kurta/35356116/buy
Indo Era,Ethnic Motifs Yoke Design Straight Kurta with Trousers & Dupatta,1999,6599,4.4,37,Women Clothing,https://www.myntra.com/kurta-sets/indo+era/indo-era-ethnic-motifs-yoke-design-straight-kurta-with-trousers--dupatta/33593694/buy
Ode by House of Pataudi,Embroidered Gota Patti A-Line Kurta with Trousers and Dupatta,1449,4999,4.2,789,Women Clothing,https://www.myntra.com/kurta-sets/ode+by+house+of+pataudi/ode-by-house-of-pataudi-embroidered-gota-patti-a-line-kurta-with-trousers-and-dupatta/26231484/buy
Sangria,Ethnic Motifs Print Empire Kurta with Trousers,1177,3799,3.5,54,Women Clothing,https://www.myntra.com/kurta-sets/sangria/sangria-ethnic-motifs-print-empire-kurta-with-trousers/31825687/buy
KALINI,Notch Neck Bandhani Embroidered Regular Thread Work Pure Cotton Kurta Set,1499,6499,4.3,2,Women Clothing,https://www.myntra.com/kurta-sets/kalini/kalini-notch-neck-bandhani-embroidered-regular-thread-work-pure-cotton-kurta-set/28754030/buy
BKApparels,Women Ethnic Motifs Printed Cotton Kurta with Trousers,599,1999,4,56,Women Clothing,https://www.myntra.com/kurta-sets/bkapparels/bkapparels-women-ethnic-motifs-printed-cotton-kurta-with-trousers/35732810/buy
Sangria,Floral Printed Straight Kurta,674,2499,4.4,22,Women Clothing,https://www.myntra.com/kurtas/sangria/sangria-floral-printed-straight-kurta/31983636/buy
KALINI,Floral Printed Gotta Patti Anarkali Kurta with Trousers & With Dupatta,1899,5799,3.6,66,Women Clothing,https://www.myntra.com/kurta-sets/kalini/kalini-floral-printed-gotta-patti-anarkali-kurta-with-trousers--with-dupatta/29834954/buy
Sangria,Blue Floral Embroidered Sequinned V-Neck A-Line Kurta With Palazzo & Dupatta,1735,5599,4,484,Women Clothing,https://www.myntra.com/kurta-sets/sangria/sangria-blue-floral-embroidered-sequinned-v-neck-a-line-kurta-with-palazzo--dupatta/29297476/buy
SEZNILA,Women Bandhani Printed Daily Straight Kurta,698,699,3.5,25,Women Clothing,https://www.myntra.com/kurtas/seznila/seznila-women-bandhani-printed-daily-straight-kurta/34852107/buy
Khushal K,Geometric Embroidered Mirror Work A-Line Kurta With Sharara & Dupatta,1679,3499,4.2,524,Women Clothing,https://www.myntra.com/kurta-sets/khushal+k/khushal-k-geometric-embroidered-mirror-work-a-line--kurta-with-sharara--dupatta/32822386/buy
Aaghnya,Women Printed Viscose Rayon Kurta Sets,1349,4345,3.4,7,Women Clothing,https://www.myntra.com/kurta-sets/aaghnya/aaghnya-women-printed-viscose-rayon-kurta-sets/35677489/buy
Varanga,Ethnic Motifs Embroidered Thread Work Kurta with Trousers,999,5599,3.9,558,Women Clothing,https://www.myntra.com/kurta-sets/varanga/varanga-ethnic-motifs-embroidered-thread-work-kurta-with-trousers/30404804/buy
Maaesa,Flared Sleeves Crepe Kaftan Kurta,749,2498,4.1,137,Women Clothing,https://www.myntra.com/kurtas/maaesa/maaesa-flared-sleeves-crepe-kaftan-kurta/27335228/buy
Rimeline,Floral Printed V-Neck Straight Kurta,619,1999,4.3,488,Women Clothing,https://www.myntra.com/kurtas/rimeline/rimeline-floral-printed-v-neck-straight-kurta/32166740/buy
Sangria,Printed Flared Sleeves Kurta & Trousers With Dupatta,1511,5599,4.1,128,Women Clothing,https://www.myntra.com/kurta-sets/sangria/sangria-printed-flared-sleeves-kurta--trousers-with-dupatta/26932934/buy
Libas,Floral Yoke Design Square Neck Thread Work A-Line Kurta,849,2999,4.2,12,Women Clothing,https://www.myntra.com/kurtas/libas/libas-floral-yoke-design-square-neck-thread-work-a-line-kurta/34139720/buy
House of Pataudi,Woven Design Round Neck Three-Quarter Sleeves Chanderi Cotton Kurta Set,1425,4599,4.1,3,Women Clothing,https://www.myntra.com/kurta-sets/house+of+pataudi/house-of-pataudi-woven-design-round-neck-three-quarter-sleeves-chanderi-cotton-kurta-set/28748096/buy
Sangria,Women Teal Blue & Red Printed Straight Kurta,489,999,4.3,2,Women Clothing,https://www.myntra.com/kurtas/sangria/sangria-women-teal-blue--red-printed-straight-kurta/13437274/buy
Aaghnya,Women Solid Kurta with Palazzo & Dupatta,869,4345,3.7,128,Women Clothing,https://www.myntra.com/kurta-sets/aaghnya/aaghnya-women-solid-kurta-with-palazzo--dupatta/34480838/buy
Libas,Floral Printed V-Neck A-Line Kurta With Trousers,1199,4149,3.6,7,Women Clothing,https://www.myntra.com/kurta-sets/libas/libas-floral-printed-v-neck-a-line-kurta-with-trousers/35166413/buy
Aaghnya,Women Floral Printed Kurta with Palazzo,699,3197,3,48,Women Clothing,https://www.myntra.com/kurta-sets/aaghnya/aaghnya-women-floral-printed-kurta-with-palazzo/34714594/buy
Indo Era,Women Floral Printed Regular Sequinned Linen Kurta with Trousers & With Dupatta,1999,4799,4.4,151,Women Clothing,https://www.myntra.com/kurta-sets/indo+era/indo-era-women-floral-printed-regular-sequinned-linen-kurta-with-trousers--with-dupatta/32982633/buy
Rimeline,Ethnic Motifs Printed Pure Cotton Straight Kurta,615,2199,4.3,124,Women Clothing,https://www.myntra.com/kurtas/rimeline/rimeline-ethnic-motifs-printed-pure-cotton-straight-kurta/31214195/buy
Anouk,Ethnic Motifs Printed Boat Neck Regular Pure Cotton Straight Kurta With Trousers,999,3499,4.4,375,Women Clothing,https://www.myntra.com/kurta-sets/anouk/anouk-ethnic-motifs-printed-boat-neck-regular-pure-cotton-straight-kurta-with-trousers/30139118/buy
VARICOS,Women Floral Printed Thread Work Maternity Anarkali Kurta,879,3999,4.1,80,Women Clothing,https://www.myntra.com/kurtas/varicos/varicos-women-floral-printed-thread-work-maternity-anarkali-kurta/28884662/buy
CaniBani,Women Silk Blend Embroidered Kurta Sets,1298,3711,3.3,36,Women Clothing,https://www.myntra.com/kurta-sets/canibani/canibani-women-silk-blend-embroidered-kurta-sets/35819925/buy
Da Vastraagaar,Floral Printed Notch Neck Pure Cotton Anarkali Kurta,899,2999,3.6,63,Women Clothing,https://www.myntra.com/kurtas/da+vastraagaar/da-vastraagaar-floral-printed-notch-neck-pure-cotton-anarkali-kurta/32659527/buy
Anouk Rustic,Women Floral Printed Regular Pure Cotton Kurta with Palazzos,999,3199,4.2,296,Women Clothing,https://www.myntra.com/kurta-sets/anouk+rustic/anouk-rustic-women-floral-printed-regular-pure-cotton-kurta-with-palazzos/32908766/buy
Indo Era,Women Floral Printed Cotton Kurta with Trousers,1699,3999,,,Women Clothing,https://www.myntra.com/kurta-sets/indo+era/indo-era-women-floral-printed-cotton-kurta-with-trousers/34334770/buy
Sangria,Printed Shoulder Strap Gotta Patti Kurta With Trousers & Dupatta,1159,3999,4.3,3,Women Clothing,https://www.myntra.com/kurta-sets/sangria/sangria-printed-shoulder-strap-gotta-patti-kurta-with-trousers--dupatta/24120282/buy
Royal Export,Geometric Printed Thread Work Anarkali Kurta with Trousers & Dupatta,979,6999,3.9,131,Women Clothing,https://www.myntra.com/kurta-sets/royal+export/royal-export-geometric-printed-thread-work-anarkali-kurta-with-trousers--dupatta/31312315/buy
Indo Era,Chevron Printed Mandarin Collar Pure Cotton Kurta with Trousers & With Dupatta,1699,6999,4.2,669,Women Clothing,https://www.myntra.com/kurta-sets/indo+era/indo-era-chevron-printed-mandarin-collar-pure-cotton-kurta-with-trousers--with-dupatta/29325358/buy
Sangria,Embroidered Anarkali Kurta,665,1799,3.8,41,Women Clothing,https://www.myntra.com/kurtas/sangria/sangria-embroidered-anarkali-kurta/33541965/buy
Sangria,Embroidery Georgette Kurta Palazzo With Dupatta Set,932,3330,4,3,Women Clothing,https://www.myntra.com/kurta-sets/sangria/sangria-embroidery-georgette-kurta-palazzo-with-dupatta-set/25189524/buy
Maaesa,Women Tie & Dye Dyed Loose Fit Kaftan Kurta,799,2497,3.7,97,Women Clothing,https://www.myntra.com/kurtas/maaesa/maaesa-women-tie--dye-dyed-loose-fit-kaftan-kurta/33395356/buy
Anouk,Floral Embroidered Round Neck Chikankari Straight Kurta,959,2999,4.4,520,Women Clothing,https://www.myntra.com/kurtas/anouk/anouk-floral-embroidered-round-neck-chikankari-straight-kurta/29965159/buy
SUTI,Geometric Printed Mandarin Collar Cotton Straight Kurta,569,2999,4.2,18,Women Clothing,https://www.myntra.com/kurtas/suti/suti-geometric-printed-mandarin-collar-cotton-straight-kurta/24705784/buy
Sangria,Embroidered Kurta Set With Dupatta,1681,5799,4.1,167,Women Clothing,https://www.myntra.com/kurta-sets/sangria/sangria-embroidered-kurta-set-with-dupatta-/30520383/buy
HERE&NOW,Women Black Pure Cotton Kurta,559,1599,4,732,Women Clothing,https://www.myntra.com/kurtas/here%26now/herenow-women-black-pure-cotton-kurta/18226460/buy
Poshak Hub,Women Embellished Georgette Anarkali Kurta,944,3499,4.3,674,Women Clothing,https://www.myntra.com/kurtas/poshak+hub/poshak-hub-women-embellished-georgette-anarkali-kurta/21591306/buy
Libas,Ethnic Motifs Woven Design Gotta Patti Straight Kurta With Trouser & Dupatta,1999,5999,4.1,37,Women Clothing,https://www.myntra.com/kurta-sets/libas/libas-ethnic-motifs-woven-design-gotta-patti-straight-kurta-with-trouser--dupatta/31197794/buy
Anouk,Maroon Floral Printed Mandarin Collar Pure Cotton Straight Kurta With Trousers,998,3699,4.5,31,Women Clothing,https://www.myntra.com/kurta-sets/anouk/anouk-maroon-floral-printed-mandarin-collar-pure-cotton-straight-kurta-with-trousers/32313658/buy
Anouk,Women White Woven Design Kurta with Trousers & Dupatta,1599,4999,4.3,4,Women Clothing,https://www.myntra.com/kurta-sets/anouk/anouk-women-white-woven-design-kurta-with-trousers--dupatta/13237566/buy
SZN,Abstract Printed Mandarin Collar Straight Kurta With Trouser And Dupatta,913,2549,4.4,14,Women Clothing,https://www.myntra.com/kurta-sets/szn/szn-abstract-printed-mandarin-collar-straight-kurta-with-trouser-and-dupatta/34717037/buy
Anouk,Women Green Bandhani Printed Summer Sheers Kurta,579,1999,4.1,407,Women Clothing,https://www.myntra.com/kurtas/anouk/anouk-women-green-bandhani-printed-summer-sheers-kurta/22709660/buy
Mizaz,Floral Printed Notch Neck Anarkali Pure Cotton Kurta With Trousers & Dupatta,1849,5249,3.4,5,Women Clothing,https://www.myntra.com/kurta-sets/mizaz/mizaz-floral-printed-notch-neck-anarkali-pure-cotton-kurta-with-trousers--dupatta/34287218/buy
Indo Era,Women Ethnic Motifs Embroidered Thread Work Pure Cotton Kurta Trousers & Dupatta,1799,4999,4.3,38,Women Clothing,https://www.myntra.com/kurta-sets/indo+era/indo-era-women-ethnic-motifs-embroidered-thread-work-pure-cotton-kurta-trousers--dupatta/33715158/buy
KALINI,Women Floral Printed Angrakha Thread Work Kurta with Trousers & With Dupatta,949,4999,4.1,155,Women Clothing,https://www.myntra.com/kurta-sets/kalini/kalini-women-floral-printed-angrakha-thread-work-kurta-with-trousers--with-dupatta/33076995/buy
Sangria,Printed Yoke Design Kurta with Palazzos,1119,3499,4,33,Women Clothing,https://www.myntra.com/kurta-sets/sangria/sangria-printed-yoke-design-kurta-with-palazzos/32330289/buy
KALINI,Women Black & Golden Floral Embroidered Anarkali Kurta,755,2699,4.2,990,Women Clothing,https://www.myntra.com/kurtas/kalini/kalini-women-black--golden-floral-embroidered-anarkali-kurta/17692818/buy
SKYLEE,Floral Printed V-Neck Straight Kurta With Trousers & Dupatta,849,1698,3.7,60,Women Clothing,https://www.myntra.com/kurta-sets/skylee/skylee-floral-printed-v-neck-straight-kurta-with-trousers--dupatta/34412118/buy
Sangria,Floral Embroidered Pure Cotton Straight Kurta With Palazzo & Dupatta,1919,5999,4.3,305,Women Clothing,https://www.myntra.com/kurta-sets/sangria/sangria-floral-embroidered-pure-cotton-straight-kurta-with-palazzo--dupatta/25472790/buy
Indo Era,Women Floral Embroidered Thread Work Pure Cotton Kurta with Palazzos,1699,3999,4.4,360,Women Clothing,https://www.myntra.com/kurta-sets/indo+era/indo-era-women-floral-embroidered-thread-work-pure-cotton-kurta-with-palazzos/32831783/buy
KALINI,Ethnic Motifs Printed Pure Cotton Kurta with Trousers & With Dupatta,703,4399,4.4,16,Women Clothing,https://www.myntra.com/kurta-sets/kalini/kalini-ethnic-motifs-printed-pure-cotton-kurta-with-trousers--with-dupatta/21989934/buy
Sangria,Floral Printed Screen Print Mandarin Collar A-Line Kurta,689,2299,4.6,9,Women Clothing,https://www.myntra.com/kurtas/sangria/sangria-floral-printed-screen-print-mandarin-collar-a-line-kurta/35129171/buy
Anouk,Women Floral Printed Kurta,474,2499,4.1,433,Women Clothing,https://www.myntra.com/kurtas/anouk/anouk-women-floral-printed-kurta/30979645/buy
Khushal K,Geometric Embellished Mirror Work A-Line Kurta With Sharara & Dupatta,1644,3499,3.8,143,Women Clothing,https://www.myntra.com/kurta-sets/khushal+k/khushal-k-geometric-embellished-mirror-work-a-line--kurta-with-sharara--dupatta/32822389/buy
Khushal K,Paisley Printed V-Neck Sleeveless Kurta with Palazzos & With Dupatta,1416,5449,4.4,1,Women Clothing,https://www.myntra.com/kurta-sets/khushal+k/khushal-k-paisley-printed-v-neck-sleeveless-kurta-with-palazzos--with-dupatta/29418628/buy
Indo Era,Pink Ethnic Motifs Embroidered Gotta Patti Kurta with Trousers & Dupatta,1899,8999,4,899,Women Clothing,https://www.myntra.com/kurta-sets/indo+era/indo-era-pink-ethnic-motifs-embroidered-gotta-patti-kurta-with-trousers--dupatta/29459964/buy
HERE&NOW,Foil Print Cotton Kurta with Trousers & Dupatta,1208,3099,4.7,11,Women Clothing,https://www.myntra.com/kurta-sets/here%26now/herenow-foil-print-cotton-kurta-with-trousers--dupatta/32414377/buy
KALINI,Notch Neck Bandhani Printed Mirror Work Straight Kurta with Trouser & Dupatta,966,3197,3.7,234,Women Clothing,https://www.myntra.com/kurta-sets/kalini/kalini-notch-neck-bandhani-printed-mirror-work-straight-kurta-with-trouser--dupatta/31937746/buy
KALINI,Black Pure Cotton Kurta Sets,1479,4699,,,Women Clothing,https://www.myntra.com/kurta-sets/kalini/kalini-black-pure-cotton-kurta-sets/35069922/buy
HERE&NOW,Women Burgundy Solid Straight Kurta,575,2399,4.1,2,Women Clothing,https://www.myntra.com/kurtas/here%26now/herenow-women-burgundy-solid-straight-kurta/2253807/buy
Anouk,Regular Pure Cotton Kurta with Trousers,987,3799,4.2,1,Women Clothing,https://www.myntra.com/kurta-sets/anouk/anouk-regular-pure-cotton-kurta-with-trousers/24175866/buy
Varanga,Women Ethnic Motifs Printed Regular Pure Cotton Kurta with Trousers,1249,3999,3.7,122,Women Clothing,https://www.myntra.com/kurta-sets/varanga/varanga-women-ethnic-motifs-printed-regular-pure-cotton-kurta-with-trousers/32911306/buy
KALINI,Embroidered Mirror Work Chanderi Cotton Kurta With Trousers & Dupatta,1633,6049,4,985,Women Clothing,https://www.myntra.com/kurta-sets/kalini/kalini-embroidered-mirror-work-chanderi-cotton-kurta-with-trousers--dupatta/24901304/buy
Anouk,Women Ethnic Motifs Printed Regular Thread Work Kurta with Palazzos,1439,3999,4.3,963,Women Clothing,https://www.myntra.com/kurta-sets/anouk/anouk-women-ethnic-motifs-printed-regular-thread-work-kurta-with-palazzos/24971734/buy
Vishudh,Red Floral Woven Design Three-Quarter Sleeves Zari Kurta,402,1549,4.2,43,Women Clothing,https://www.myntra.com/kurtas/vishudh/vishudh-red-floral-woven-design-three-quarter-sleeves-zari-kurta/31580361/buy
GoSriKi,Ethnic Motifs Printed Straight Kurta With Trousers,639,3197,3.6,923,Women Clothing,https://www.myntra.com/kurta-sets/gosriki/gosriki-ethnic-motifs-printed-straight-kurta-with-trousers/30868459/buy
Indo Era,Floral Printed Beads and Stones Linen Straight Kurta with Trouser & Dupatta,1899,4799,4.4,136,Women Clothing,https://www.myntra.com/kurta-sets/indo+era/indo-era-floral-printed-beads-and-stones-linen-straight-kurta-with-trouser--dupatta/33039128/buy
Vbuyz,Floral Printed Straight Kurta,637,2899,4.1,82,Women Clothing,https://www.myntra.com/kurtas/vbuyz/vbuyz-floral-printed-straight-kurta/30167454/buy
KALINI,Floral Printed Keyhole Neck Anarkali Kurta with Trousers And Dupatta,949,4999,4,912,Women Clothing,https://www.myntra.com/kurta-sets/kalini/kalini-floral-printed-keyhole-neck-anarkali-kurta-with-trousers-and-dupatta/32663830/buy
KIMAYRA,Ethnic Motifs Printed Pure Cotton Kurta with Palazzos & Dupatta,1265,3699,4.2,1,Women Clothing,https://www.myntra.com/kurta-sets/kimayra/kimayra-ethnic-motifs-printed-pure-cotton-kurta-with-palazzos--dupatta/28935104/buy
Nayo,Women Blue Floral Pure Cotton Kurta with Trousers & With Dupatta,1499,3499,4,7,Women Clothing,https://www.myntra.com/kurta-sets/nayo/nayo-women-blue-floral-pure-cotton-kurta-with-trousers--with-dupatta/14226530/buy
Sangria,Navy Blue Floral Printed Pure Cotton Anarkali Kurta With Trousers & Dupatta,1359,7999,3.9,32,Women Clothing,https://www.myntra.com/kurta-sets/sangria/sangria-navy-blue-floral-printed-pure-cotton-anarkali-kurta-with-trousers--dupatta/30901430/buy
Khushal K,Women Floral Printed Gotta Patti Pure Cotton Kurta with Palazzos & Dupatta,1652,5699,4.1,3,Women Clothing,https://www.myntra.com/kurta-sets/khushal+k/khushal-k-women-floral-printed-gotta-patti-pure-cotton-kurta-with-palazzos--dupatta/21285838/buy
KALINI,Women Floral Printed Kurta with Trousers & Dupatta,1199,3599,2.6,56,Women Clothing,https://www.myntra.com/kurta-sets/kalini/kalini-women-floral-printed-kurta-with-trousers--dupatta/36051713/buy
SWAGG INDIA,Women Maroon Ethnic Motifs Embroidered Kurta with Trousers & With Dupatta,1199,4999,4,3,Women Clothing,https://www.myntra.com/kurta-sets/swagg+india/swagg-india-women-maroon-ethnic-motifs-embroidered-kurta-with-trousers--with-dupatta/16614140/buy
GoSriKi,Floral Printed Straight Kurta With Trousers & Dupatta,999,4345,3,483,Women Clothing,https://www.myntra.com/kurta-sets/gosriki/gosriki-floral-printed-straight-kurta-with-trousers--dupatta/31471660/buy
Indo Era,Floral Printed Regular Sequinned Pure Cotton Kurta with Trousers & Dupatta,1499,7599,4.5,427,Women Clothing,https://www.myntra.com/kurta-sets/indo+era/indo-era-floral-printed-regular-sequinned-pure-cotton-kurta-with-trousers--dupatta/29224634/buy
Sangria,Floral Printed Round Neck Kurta Trouser With Dupatta.,1342,7899,4.1,30,Women Clothing,https://www.myntra.com/kurta-sets/sangria/sangria-floral-printed-round-neck-kurta-trouser-with-dupatta/32748780/buy
